{
 "name": "Aprender español - Learn Spanish",
 "type": "public_channel",
 "id": 1055581587,
 "messages": [
  {
   "id": 1,
   "type": "service",
   "date": "2016-06-29T05:09:31",
   "date_unixtime": "1467151771",
   "actor": "Aprender español - Learn Spanish",
   "actor_id": "channel1055581587",
   "action": "create_channel",
   "title": "Español Spanish",
   "text": "",
   "text_entities": []
  },
  {
   "id": 2,
   "type": "message",
   "date": "2016-06-29T05:12:03",
   "date_unixtime": "1467151923",
   "from": "Aprender español - Learn Spanish",
   "from_id": "channel1055581587",
   "text": [
    "También vs Tampoco. When and how to use it 👉 ",
    {
     "type": "link",
     "text": "http://www.spanish.cl/grammar-rules/tambien-tampoco.htm"
    },
    ""
   ],
   "text_entities": [
    {
     "type": "plain",
     "text": "También vs Tampoco. When and how to use it 👉 "
    },
    {
     "type": "link",
     "text": "http://www.spanish.cl/grammar-rules/tambien-tampoco.htm"
    },
    {
     "type": "plain",
     "text": ""
    }
   ]
  },
  {
   "id": 3,
   "type": "service",
   "date": "2016-06-29T05:13:10",
   "date_unixtime": "1467151990",
   "actor": "Aprender español - Learn Spanish",
   "actor_id": "channel1055581587",
   "action": "edit_group_photo",
   "photo": "photos/photo_1@29-06-2016_05-13-10.jpg",
   "width": 640,
   "height": 640,
   "text": "",
   "text_entities": []
  },
  {
   "id": 22,
   "type": "message",
   "date": "2016-06-29T05:21:02",
   "date_unixtime": "1467152462",
   "edited": "2016-06-29T05:25:27",
   "edited_unixtime": "1467152727",
   "from": "Aprender español - Learn Spanish",
   "from_id": "channel1055581587",
   "photo": "photos/photo_2@29-06-2016_05-21-02.jpg",
   "width": 1280,
   "height": 1280,
   "text": "Slang argentino: bolacear chanta chorear charleta",
   "text_entities": [
    {
     "type": "plain",
     "text": "Slang argentino: bolacear chanta chorear charleta"
    }
   ]
  },
  {
   "id": 23,
   "type": "message",
   "date": "2016-06-29T05:21:26",
   "date_unixtime": "1467152486",
   "edited": "2016-06-29T05:22:00",
   "edited_unixtime": "1467152520",
   "from": "Aprender español - Learn Spanish",
   "from_id": "channel1055581587",
   "photo": "photos/photo_3@29-06-2016_05-21-26.jpg",
   "width": 1280,
   "height": 781,
   "text": "Hay ahí ay",
   "text_entities": [
    {
     "type": "plain",
     "text": "Hay ahí ay"
    }
   ]
  },
  {
   "id": 24,
   "type": "message",
   "date": "2016-06-29T05:22:09",
   "date_unixtime": "1467152529",
   "from": "Aprender español - Learn Spanish",
   "from_id": "channel1055581587",
   "photo": "photos/photo_4@29-06-2016_05-22-09.jpg",
   "width": 960,
   "height": 720,
   "text": "",
   "text_entities": []
  },
  {
   "id": 25,
   "type": "message",
   "date": "2016-06-29T05:22:51",
   "date_unixtime": "1467152571",
   "edited": "2016-06-29T05:23:00",
   "edited_unixtime": "1467152580",
   "from": "Aprender español - Learn Spanish",
   "from_id": "channel1055581587",
   "photo": "photos/photo_5@29-06-2016_05-22-51.jpg",
   "width": 1280,
   "height": 720,
   "text": "El y lo",
   "text_entities": [
    {
     "type": "plain",
     "text": "El y lo"
    }
   ]
  },
  {
   "id": 27,
   "type": "message",
   "date": "2016-06-29T05:23:26",
   "date_unixtime": "1467152606",
   "edited": "2016-06-29T05:24:01",
   "edited_unixtime": "1467152641",
   "from": "Aprender español - Learn Spanish",
   "from_id": "channel1055581587",
   "photo": "photos/photo_6@29-06-2016_05-23-26.jpg",
   "width": 728,
   "height": 546,
   "text": "¿Subjuntivo o indicativo?",
   "text_entities": [
    {
     "type": "plain",
     "text": "¿Subjuntivo o indicativo?"
    }
   ]
  },
  {
   "id": 28,
   "type": "message",
   "date": "2016-06-29T05:24:20",
   "date_unixtime": "1467152660",
   "from": "Aprender español - Learn Spanish",
   "from_id": "channel1055581587",
   "photo": "photos/photo_7@29-06-2016_05-24-20.jpg",
   "width": 728,
   "height": 546,
   "text": "",
   "text_entities": []
  },
  {
   "id": 29,
   "type": "message",
   "date": "2016-06-29T05:24:20",
   "date_unixtime": "1467152660",
   "from": "Aprender español - Learn Spanish",
   "from_id": "channel1055581587",
   "photo": "photos/photo_8@29-06-2016_05-24-20.jpg",
   "width": 728,
   "height": 546,
   "text": "",
   "text_entities": []
  },
  {
   "id": 30,
   "type": "message",
   "date": "2016-06-29T05:24:21",
   "date_unixtime": "1467152661",
   "from": "Aprender español - Learn Spanish",
   "from_id": "channel1055581587",
   "photo": "photos/photo_9@29-06-2016_05-24-21.jpg",
   "width": 728,
   "height": 546,
   "text": "",
   "text_entities": []
  },
  {
   "id": 31,
   "type": "message",
   "date": "2016-06-29T05:24:21",
   "date_unixtime": "1467152661",
   "from": "Aprender español - Learn Spanish",
   "from_id": "channel1055581587",
   "photo": "photos/photo_10@29-06-2016_05-24-21.jpg",
   "width": 728,
   "height": 546,
   "text": "",
   "text_entities": []
  },
  {
   "id": 32,
   "type": "message",
   "date": "2016-06-29T05:24:37",
   "date_unixtime": "1467152677",
   "edited": "2016-06-29T05:24:54",
   "edited_unixtime": "1467152694",
   "from": "Aprender español - Learn Spanish",
   "from_id": "channel1055581587",
   "photo": "photos/photo_11@29-06-2016_05-24-37.jpg",
   "width": 401,
   "height": 601,
   "text": "Slang argentino: re",
   "text_entities": [
    {
     "type": "plain",
     "text": "Slang argentino: re"
    }
   ]
  },
  {
   "id": 33,
   "type": "message",
   "date": "2016-06-29T05:42:46",
   "date_unixtime": "1467153766",
   "from": "Aprender español - Learn Spanish",
   "from_id": "channel1055581587",
   "text": [
    "¿Cómo usar las tildes? \n",
    {
     "type": "link",
     "text": "https://youtu.be/vss0uNTxaqw"
    },
    ""
   ],
   "text_entities": [
    {
     "type": "plain",
     "text": "¿Cómo usar las tildes? \n"
    },
    {
     "type": "link",
     "text": "https://youtu.be/vss0uNTxaqw"
    },
    {
     "type": "plain",
     "text": ""
    }
   ]
  },
  {
   "id": 34,
   "type": "message",
   "date": "2016-06-29T07:47:11",
   "date_unixtime": "1467161231",
   "from": "Aprender español - Learn Spanish",
   "from_id": "channel1055581587",
   "text": [
    "Learn Spanish from Scratch. A self study guide. \n",
    {
     "type": "link",
     "text": "http://www.tobefluent.com/2014/07/30/how-i-learned-spanish-from-scratch-a-self-study-guide/"
    }
   ],
   "text_entities": [
    {
     "type": "plain",
     "text": "Learn Spanish from Scratch. A self study guide. \n"
    },
    {
     "type": "link",
     "text": "http://www.tobefluent.com/2014/07/30/how-i-learned-spanish-from-scratch-a-self-study-guide/"
    }
   ]
  },
  {
   "id": 36,
   "type": "message",
   "date": "2016-06-29T08:37:41",
   "date_unixtime": "1467164261",
   "edited": "2020-06-04T05:12:20",
   "edited_unixtime": "1591222340",
   "from": "Aprender español - Learn Spanish",
   "from_id": "channel1055581587",
   "photo": "photos/photo_12@29-06-2016_08-37-41.jpg",
   "width": 600,
   "height": 338,
   "text": [
    "Extr@  Learn spanish watching this serie (each episode includes the vocabulary used and exercises). \nAprende con esta serie (Cada episodio incluye vocabulario y ejercicios)  \n\n",
    {
     "type": "bold",
     "text": "You can watch it in these sites: "
    },
    "\n\n",
    {
     "type": "link",
     "text": "https://www.celebratelanguages.com/vidse01n.html"
    },
    "\n\n",
    {
     "type": "link",
     "text": "https://spanish.yabla.com/Extr%40-Extra-en-espa%C3%B1ol-series-3860"
    }
   ],
   "text_entities": [
    {
     "type": "plain",
     "text": "Extr@  Learn spanish watching this serie (each episode includes the vocabulary used and exercises). \nAprende con esta serie (Cada episodio incluye vocabulario y ejercicios)  \n\n"
    },
    {
     "type": "bold",
     "text": "You can watch it in these sites: "
    },
    {
     "type": "plain",
     "text": "\n\n"
    },
    {
     "type": "link",
     "text": "https://www.celebratelanguages.com/vidse01n.html"
    },
    {
     "type": "plain",
     "text": "\n\n"
    },
    {
     "type": "link",
     "text": "https://spanish.yabla.com/Extr%40-Extra-en-espa%C3%B1ol-series-3860"
    }
   ]
  },
  {
   "id": 38,
   "type": "message",
   "date": "2016-06-30T13:20:05",
   "date_unixtime": "1467267605",
   "from": "Aprender español - Learn Spanish",
   "from_id": "channel1055581587",
   "file": "files/Super-ortografia-facil.pdf",
   "mime_type": "application/pdf",
   "text": "",
   "text_entities": []
  },
  {
   "id": 39,
   "type": "message",
   "date": "2016-06-30T13:20:33",
   "date_unixtime": "1467267633",
   "from": "Aprender español - Learn Spanish",
   "from_id": "channel1055581587",
   "file": "files/RAE ortografía de la lengua española.pdf",
   "mime_type": "application/pdf",
   "text": "",
   "text_entities": []
  },
  {
   "id": 40,
   "type": "message",
   "date": "2016-06-30T13:20:40",
   "date_unixtime": "1467267640",
   "from": "Aprender español - Learn Spanish",
   "from_id": "channel1055581587",
   "file": "files/gramatica.pdf",
   "mime_type": "application/pdf",
   "text": "",
   "text_entities": []
  },
  {
   "id": 41,
   "type": "message",
   "date": "2016-06-30T13:21:12",
   "date_unixtime": "1467267672",
   "from": "Aprender español - Learn Spanish",
   "from_id": "channel1055581587",
   "file": "files/Gramatica de la lengua espanola.pdf",
   "mime_type": "application/pdf",
   "text": "",
   "text_entities": []
  },
  {
   "id": 42,
   "type": "message",
   "date": "2016-06-30T13:21:19",
   "date_unixtime": "1467267679",
   "from": "Aprender español - Learn Spanish",
   "from_id": "channel1055581587",
   "file": "files/estudios de gramatica.pdf",
   "mime_type": "application/pdf",
   "text": "",
   "text_entities": []
  },
  {
   "id": 43,
   "type": "message",
   "date": "2016-06-30T23:57:18",
   "date_unixtime": "1467305838",
   "edited": "2016-06-30T23:57:54",
   "edited_unixtime": "1467305874",
   "from": "Aprender español - Learn Spanish",
   "from_id": "channel1055581587",
   "photo": "photos/photo_13@30-06-2016_23-57-18.jpg",
   "width": 785,
   "height": 544,
   "text": "Subjuntivo e indicativo de \"Ir\"",
   "text_entities": [
    {
     "type": "plain",
     "text": "Subjuntivo e indicativo de \"Ir\""
    }
   ]
  },
  {
   "id": 44,
   "type": "message",
   "date": "2016-06-30T23:57:18",
   "date_unixtime": "1467305838",
   "edited": "2016-06-30T23:58:24",
   "edited_unixtime": "1467305904",
   "from": "Aprender español - Learn Spanish",
   "from_id": "channel1055581587",
   "photo": "photos/photo_14@30-06-2016_23-57-18.jpg",
   "width": 783,
   "height": 543,
   "text": "Subjuntivo e indicativo de \"Decir\"",
   "text_entities": [
    {
     "type": "plain",
     "text": "Subjuntivo e indicativo de \"Decir\""
    }
   ]
  },
  {
   "id": 45,
   "type": "message",
   "date": "2016-07-01T05:36:06",
   "date_unixtime": "1467326166",
   "from": "Aprender español - Learn Spanish",
   "from_id": "channel1055581587",
   "text": "🔰Diferencias básicas entre SER y ESTAR 🔰\n\n📍SER sirve para identificar. 1=1\n• Jorge es guapo.\n• Asia es polaca.\n• Chan es estudiante y trabajadora.\n\n📍ESTAR sirve para localizar y para indicar resultado. También acción en desarrollo (estar+gerundio).\n\nLocalizar: usamos siempre \"estar en\".\n• Màrcio está en Brasil.\n• La pizza está en el horno.\n• Estoy en casa.\n[Excepción: eventos. Si hablamos de un evento, usamos \"ser en\" (= tiene lugar/ ocurre): La fiesta es en mi casa. La reunión es en la sala 123.]\n\nResultado: podemos usar pretérito perfecto para decir lo mismo.\n• La puerta está abierta <-- He abierto la puerta.\n• Cervantes está muerto <-- Cervantes ha muerto.\n• Chan está loca <-- Ha enloquecido / Se ha vuelto loca.\n\nAcción en desarrollo: estar + gerundio. No existe \"ser + gerundio\".\n• Estoy estudiando español.\n• Está lloviendo.\n• Estamos hablando en español.\n\nHay otros casos más concretos, pero los dejamos para otro mensaje. 😊",
   "text_entities": [
    {
     "type": "plain",
     "text": "🔰Diferencias básicas entre SER y ESTAR 🔰\n\n📍SER sirve para identificar. 1=1\n• Jorge es guapo.\n• Asia es polaca.\n• Chan es estudiante y trabajadora.\n\n📍ESTAR sirve para localizar y para indicar resultado. También acción en desarrollo (estar+gerundio).\n\nLocalizar: usamos siempre \"estar en\".\n• Màrcio está en Brasil.\n• La pizza está en el horno.\n• Estoy en casa.\n[Excepción: eventos. Si hablamos de un evento, usamos \"ser en\" (= tiene lugar/ ocurre): La fiesta es en mi casa. La reunión es en la sala 123.]\n\nResultado: podemos usar pretérito perfecto para decir lo mismo.\n• La puerta está abierta <-- He abierto la puerta.\n• Cervantes está muerto <-- Cervantes ha muerto.\n• Chan está loca <-- Ha enloquecido / Se ha vuelto loca.\n\nAcción en desarrollo: estar + gerundio. No existe \"ser + gerundio\".\n• Estoy estudiando español.\n• Está lloviendo.\n• Estamos hablando en español.\n\nHay otros casos más concretos, pero los dejamos para otro mensaje. 😊"
    }
   ]
  },
  {
   "id": 46,
   "type": "message",
   "date": "2016-07-02T00:11:02",
   "date_unixtime": "1467393062",
   "edited": "2016-07-02T00:16:06",
   "edited_unixtime": "1467393366",
   "from": "Aprender español - Learn Spanish",
   "from_id": "channel1055581587",
   "file": "files/Spanish for beginners.pdf",
   "mime_type": "application/pdf",
   "text": "Spanish for dummies. If you are learning Spanish from scratch, this book can help you.",
   "text_entities": [
    {
     "type": "plain",
     "text": "Spanish for dummies. If you are learning Spanish from scratch, this book can help you."
    }
   ]
  },
  {
   "id": 47,
   "type": "message",
   "date": "2016-07-02T00:12:43",
   "date_unixtime": "1467393163",
   "edited": "2016-07-02T00:15:03",
   "edited_unixtime": "1467393303",
   "from": "Aprender español - Learn Spanish",
   "from_id": "channel1055581587",
   "file": "files/Learn Spanish 6 000 Words_v4.9_apkpure.com.apk",
   "mime_type": "application/vnd.android.package-archive",
   "text": "App to learn 6000 Spanish words. \nAplicación para aprender vocabulario.",
   "text_entities": [
    {
     "type": "plain",
     "text": "App to learn 6000 Spanish words. \nAplicación para aprender vocabulario."
    }
   ]
  },
  {
   "id": 49,
   "type": "message",
   "date": "2016-07-05T07:05:13",
   "date_unixtime": "1467677113",
   "from": "Aprender español - Learn Spanish",
   "from_id": "channel1055581587",
   "text": [
    {
     "type": "link",
     "text": "http://www.speakspanishba.com/canciones-para-aprender-espanol-songs-to-learn-spanish/"
    }
   ],
   "text_entities": [
    {
     "type": "link",
     "text": "http://www.speakspanishba.com/canciones-para-aprender-espanol-songs-to-learn-spanish/"
    }
   ]
  },
  {
   "id": 51,
   "type": "message",
   "date": "2016-07-06T05:37:26",
   "date_unixtime": "1467758246",
   "from": "Aprender español - Learn Spanish",
   "from_id": "channel1055581587",
   "text": [
    {
     "type": "link",
     "text": "https://t.co/zkJE1sDpur"
    }
   ],
   "text_entities": [
    {
     "type": "link",
     "text": "https://t.co/zkJE1sDpur"
    }
   ]
  },
  {
   "id": 52,
   "type": "message",
   "date": "2016-07-07T13:44:37",
   "date_unixtime": "1467873877",
   "from": "Aprender español - Learn Spanish",
   "from_id": "channel1055581587",
   "text": [
    "Consejos para aprender español con tu smartphone.\n\n",
    {
     "type": "link",
     "text": "http://www.habla.pl/2013/12/10/apps-que-no-pueden-faltar-a-un-estudiante-de-espanol/"
    },
    ""
   ],
   "text_entities": [
    {
     "type": "plain",
     "text": "Consejos para aprender español con tu smartphone.\n\n"
    },
    {
     "type": "link",
     "text": "http://www.habla.pl/2013/12/10/apps-que-no-pueden-faltar-a-un-estudiante-de-espanol/"
    },
    {
     "type": "plain",
     "text": ""
    }
   ]
  },
  {
   "id": 53,
   "type": "message",
   "date": "2016-07-19T18:53:04",
   "date_unixtime": "1468929184",
   "from": "Aprender español - Learn Spanish",
   "from_id": "channel1055581587",
   "text": [
    "Online Courses: 📚\n\nDuolingo (on PC or mobile web-browser, preferably): \n",
    {
     "type": "link",
     "text": "https://www.duolingo.com/course/es/en/Learn-Spanish-Online"
    },
    "\n\n",
    {
     "type": "link",
     "text": "http://www.fluencia.com"
    },
    "\n\n",
    {
     "type": "link",
     "text": "http://www.memrise.com/courses/english/spanish/"
    },
    "\n\n",
    {
     "type": "link",
     "text": "http://www.mangolanguages.com"
    },
    ""
   ],
   "text_entities": [
    {
     "type": "plain",
     "text": "Online Courses: 📚\n\nDuolingo (on PC or mobile web-browser, preferably): \n"
    },
    {
     "type": "link",
     "text": "https://www.duolingo.com/course/es/en/Learn-Spanish-Online"
    },
    {
     "type": "plain",
     "text": "\n\n"
    },
    {
     "type": "link",
     "text": "http://www.fluencia.com"
    },
    {
     "type": "plain",
     "text": "\n\n"
    },
    {
     "type": "link",
     "text": "http://www.memrise.com/courses/english/spanish/"
    },
    {
     "type": "plain",
     "text": "\n\n"
    },
    {
     "type": "link",
     "text": "http://www.mangolanguages.com"
    },
    {
     "type": "plain",
     "text": ""
    }
   ]
  },
  {
   "id": 56,
   "type": "message",
   "date": "2016-07-20T00:12:18",
   "date_unixtime": "1468948338",
   "edited": "2016-07-20T00:13:36",
   "edited_unixtime": "1468948416",
   "from": "Aprender español - Learn Spanish",
   "from_id": "channel1055581587",
   "file": "files/Uso_Interactivo_del_vocabulario_A-B1.pdf",
   "mime_type": "application/pdf",
   "text": [
    "USO INTERACTIVO DEL VOCABULARIO NIVEL A-B1\nISBN ",
    {
     "type": "phone",
     "text": "9788477119784"
    },
    "\nANGELES ENCINAR , EDELSA, 2012\n\nDATOS DEL LIBRO\nNº de páginas: 192 págs.\nEncuadernación: Tapa blanda\nEditorial: EDELSA\nLengua: CASTELLANO"
   ],
   "text_entities": [
    {
     "type": "plain",
     "text": "USO INTERACTIVO DEL VOCABULARIO NIVEL A-B1\nISBN "
    },
    {
     "type": "phone",
     "text": "9788477119784"
    },
    {
     "type": "plain",
     "text": "\nANGELES ENCINAR , EDELSA, 2012\n\nDATOS DEL LIBRO\nNº de páginas: 192 págs.\nEncuadernación: Tapa blanda\nEditorial: EDELSA\nLengua: CASTELLANO"
    }
   ]
  },
  {
   "id": 58,
   "type": "message",
   "date": "2016-07-20T00:16:55",
   "date_unixtime": "1468948615",
   "from": "Aprender español - Learn Spanish",
   "from_id": "channel1055581587",
   "file": "(File exceeds maximum size. Change data exporting settings to download.)",
   "mime_type": "application/x-rar",
   "text": "",
   "text_entities": []
  },
  {
   "id": 59,
   "type": "message",
   "date": "2016-07-20T00:18:06",
   "date_unixtime": "1468948686",
   "edited": "2016-07-20T00:18:16",
   "edited_unixtime": "1468948696",
   "from": "Aprender español - Learn Spanish",
   "from_id": "channel1055581587",
   "file": "files/Dirty Spanish.pdf",
   "mime_type": "application/pdf",
   "text": "GET D!RTY! Next time you're traveling or just chattin' in Spanish with your friends, drop the textbook formality and bust out with expressions they never teach you in school, including: * cool slang *",
   "text_entities": [
    {
     "type": "plain",
     "text": "GET D!RTY! Next time you're traveling or just chattin' in Spanish with your friends, drop the textbook formality and bust out with expressions they never teach you in school, including: * cool slang *"
    }
   ]
  },
  {
   "id": 60,
   "type": "message",
   "date": "2016-07-20T04:34:48",
   "date_unixtime": "1468964088",
   "from": "Aprender español - Learn Spanish",
   "from_id": "channel1055581587",
   "text": [
    "Online Dictionaries - Diccionarios 🤓\n",
    {
     "type": "link",
     "text": "http://www.rae.es"
    },
    "\n",
    {
     "type": "link",
     "text": "http://www.wordreference.com"
    },
    "\n",
    {
     "type": "link",
     "text": "http://www.collinsdictionary.com/dictionary/english-spanish"
    },
    "\n",
    {
     "type": "link",
     "text": "https://es.m.wiktionary.org/wiki/Wikcionario:Portada"
    },
    "\n",
    {
     "type": "link",
     "text": "http://www.spanishdict.com"
    },
    ""
   ],
   "text_entities": [
    {
     "type": "plain",
     "text": "Online Dictionaries - Diccionarios 🤓\n"
    },
    {
     "type": "link",
     "text": "http://www.rae.es"
    },
    {
     "type": "plain",
     "text": "\n"
    },
    {
     "type": "link",
     "text": "http://www.wordreference.com"
    },
    {
     "type": "plain",
     "text": "\n"
    },
    {
     "type": "link",
     "text": "http://www.collinsdictionary.com/dictionary/english-spanish"
    },
    {
     "type": "plain",
     "text": "\n"
    },
    {
     "type": "link",
     "text": "https://es.m.wiktionary.org/wiki/Wikcionario:Portada"
    },
    {
     "type": "plain",
     "text": "\n"
    },
    {
     "type": "link",
     "text": "http://www.spanishdict.com"
    },
    {
     "type": "plain",
     "text": ""
    }
   ]
  },
  {
   "id": 61,
   "type": "message",
   "date": "2016-07-20T04:35:59",
   "date_unixtime": "1468964159",
   "from": "Aprender español - Learn Spanish",
   "from_id": "channel1055581587",
   "text": [
    "Reading Practice 📚\n",
    {
     "type": "link",
     "text": "https://es.m.wikipedia.org/wiki/Wikipedia:Portada"
    },
    "\n",
    {
     "type": "link",
     "text": "http://www.univision.com"
    },
    "\n",
    {
     "type": "link",
     "text": "http://cnnespanol.cnn.com"
    },
    "\n",
    {
     "type": "link",
     "text": "http://www.bbc.com/mundo"
    },
    "\n",
    {
     "type": "link",
     "text": "http://www.telemundo.com/noticias"
    },
    "\n",
    {
     "type": "link",
     "text": "http://libguides.mit.edu/c.php?g=176072&p=1158992"
    },
    ""
   ],
   "text_entities": [
    {
     "type": "plain",
     "text": "Reading Practice 📚\n"
    },
    {
     "type": "link",
     "text": "https://es.m.wikipedia.org/wiki/Wikipedia:Portada"
    },
    {
     "type": "plain",
     "text": "\n"
    },
    {
     "type": "link",
     "text": "http://www.univision.com"
    },
    {
     "type": "plain",
     "text": "\n"
    },
    {
     "type": "link",
     "text": "http://cnnespanol.cnn.com"
    },
    {
     "type": "plain",
     "text": "\n"
    },
    {
     "type": "link",
     "text": "http://www.bbc.com/mundo"
    },
    {
     "type": "plain",
     "text": "\n"
    },
    {
     "type": "link",
     "text": "http://www.telemundo.com/noticias"
    },
    {
     "type": "plain",
     "text": "\n"
    },
    {
     "type": "link",
     "text": "http://libguides.mit.edu/c.php?g=176072&p=1158992"
    },
    {
     "type": "plain",
     "text": ""
    }
   ]
  },
  {
   "id": 62,
   "type": "message",
   "date": "2016-07-20T04:38:29",
   "date_unixtime": "1468964309",
   "from": "Aprender español - Learn Spanish",
   "from_id": "channel1055581587",
   "text": [
    "Listening practice & spanish pronunciation help 👂🏻\n",
    {
     "type": "link",
     "text": "http://forvo.com/languages/es/"
    },
    "\n",
    {
     "type": "link",
     "text": "http://www.fluentu.com/spanish"
    },
    "\n",
    {
     "type": "link",
     "text": "https://www.spanishpod101.com"
    },
    ""
   ],
   "text_entities": [
    {
     "type": "plain",
     "text": "Listening practice & spanish pronunciation help 👂🏻\n"
    },
    {
     "type": "link",
     "text": "http://forvo.com/languages/es/"
    },
    {
     "type": "plain",
     "text": "\n"
    },
    {
     "type": "link",
     "text": "http://www.fluentu.com/spanish"
    },
    {
     "type": "plain",
     "text": "\n"
    },
    {
     "type": "link",
     "text": "https://www.spanishpod101.com"
    },
    {
     "type": "plain",
     "text": ""
    }
   ]
  },
  {
   "id": 63,
   "type": "message",
   "date": "2016-07-20T04:41:06",
   "date_unixtime": "1468964466",
   "from": "Aprender español - Learn Spanish",
   "from_id": "channel1055581587",
   "text": [
    {
     "type": "link",
     "text": "http://www.spanishdict.com/grammar"
    },
    " Spanish Grammar help section: We created more than 100 short, easy-to-understand explanations of Spanish Grammar topics. Then we paired the explanations with 40 practice questions so that you can test your knowledge and ensure you've mastered the topic."
   ],
   "text_entities": [
    {
     "type": "link",
     "text": "http://www.spanishdict.com/grammar"
    },
    {
     "type": "plain",
     "text": " Spanish Grammar help section: We created more than 100 short, easy-to-understand explanations of Spanish Grammar topics. Then we paired the explanations with 40 practice questions so that you can test your knowledge and ensure you've mastered the topic."
    }
   ]
  },
  {
   "id": 64,
   "type": "message",
   "date": "2016-07-25T00:54:33",
   "date_unixtime": "1469382873",
   "from": "Aprender español - Learn Spanish",
   "from_id": "channel1055581587",
   "text": [
    {
     "type": "link",
     "text": "http://www.habla.pl/2016/05/17/contraste-presenteimperfecto-de-subjuntivo-con-musica/"
    }
   ],
   "text_entities": [
    {
     "type": "link",
     "text": "http://www.habla.pl/2016/05/17/contraste-presenteimperfecto-de-subjuntivo-con-musica/"
    }
   ]
  },
  {
   "id": 65,
   "type": "message",
   "date": "2016-07-26T05:36:23",
   "date_unixtime": "1469486183",
   "edited": "2016-07-26T05:37:00",
   "edited_unixtime": "1469486220",
   "from": "Aprender español - Learn Spanish",
   "from_id": "channel1055581587",
   "text": [
    "Otros canales recomendados para aprender español:\n",
    {
     "type": "link",
     "text": "https://telegram.me/Me_encanta_el_espanol"
    },
    "\n\n",
    {
     "type": "link",
     "text": "https://telegram.me/Frases"
    },
    "\n\n",
    {
     "type": "link",
     "text": "https://telegram.me/curiosos"
    },
    ""
   ],
   "text_entities": [
    {
     "type": "plain",
     "text": "Otros canales recomendados para aprender español:\n"
    },
    {
     "type": "link",
     "text": "https://telegram.me/Me_encanta_el_espanol"
    },
    {
     "type": "plain",
     "text": "\n\n"
    },
    {
     "type": "link",
     "text": "https://telegram.me/Frases"
    },
    {
     "type": "plain",
     "text": "\n\n"
    },
    {
     "type": "link",
     "text": "https://telegram.me/curiosos"
    },
    {
     "type": "plain",
     "text": ""
    }
   ]
  },
  {
   "id": 66,
   "type": "message",
   "date": "2016-07-26T05:57:57",
   "date_unixtime": "1469487477",
   "from": "Aprender español - Learn Spanish",
   "from_id": "channel1055581587",
   "photo": "photos/photo_15@26-07-2016_05-57-57.jpg",
   "width": 720,
   "height": 720,
   "text": "",
   "text_entities": []
  },
  {
   "id": 67,
   "type": "message",
   "date": "2016-07-26T06:46:43",
   "date_unixtime": "1469490403",
   "edited": "2016-07-26T07:52:55",
   "edited_unixtime": "1469494375",
   "from": "Aprender español - Learn Spanish",
   "from_id": "channel1055581587",
   "file": "files/Spanish (Latin America) Level 1 - Student Workbook.pdf",
   "mime_type": "application/pdf",
   "text": [
    "Rosetta Stone Spanish Workbook + Answer Key ",
    {
     "type": "hashtag",
     "text": "#book"
    },
    "                                                                 ",
    {
     "type": "link",
     "text": "https://telegram.me/aprenderespanol"
    }
   ],
   "text_entities": [
    {
     "type": "plain",
     "text": "Rosetta Stone Spanish Workbook + Answer Key "
    },
    {
     "type": "hashtag",
     "text": "#book"
    },
    {
     "type": "plain",
     "text": "                                                                 "
    },
    {
     "type": "link",
     "text": "https://telegram.me/aprenderespanol"
    }
   ]
  },
  {
   "id": 68,
   "type": "message",
   "date": "2016-07-26T06:48:15",
   "date_unixtime": "1469490495",
   "edited": "2016-07-26T07:53:46",
   "edited_unixtime": "1469494426",
   "from": "Aprender español - Learn Spanish",
   "from_id": "channel1055581587",
   "file": "files/Spanish_(Latin_America)_Level_1_-_Answer_Key.pdf",
   "mime_type": "application/pdf",
   "text": [
    {
     "type": "mention",
     "text": "@aprenderespanol"
    }
   ],
   "text_entities": [
    {
     "type": "mention",
     "text": "@aprenderespanol"
    }
   ]
  },
  {
   "id": 69,
   "type": "message",
   "date": "2016-07-26T07:27:12",
   "date_unixtime": "1469492832",
   "edited": "2016-07-26T07:53:53",
   "edited_unixtime": "1469494433",
   "from": "Aprender español - Learn Spanish",
   "from_id": "channel1055581587",
   "file": "files/Spanish_(Latin_America)_Level_2_-_Student_Workbook.pdf",
   "mime_type": "application/pdf",
   "text": [
    "Rosetta Stone Spanish Workbook level 2 + Answer Key ",
    {
     "type": "hashtag",
     "text": "#book"
    },
    "  ",
    {
     "type": "mention",
     "text": "@aprenderespanol"
    }
   ],
   "text_entities": [
    {
     "type": "plain",
     "text": "Rosetta Stone Spanish Workbook level 2 + Answer Key "
    },
    {
     "type": "hashtag",
     "text": "#book"
    },
    {
     "type": "plain",
     "text": "  "
    },
    {
     "type": "mention",
     "text": "@aprenderespanol"
    }
   ]
  },
  {
   "id": 70,
   "type": "message",
   "date": "2016-07-26T07:28:47",
   "date_unixtime": "1469492927",
   "edited": "2016-07-26T07:53:59",
   "edited_unixtime": "1469494439",
   "from": "Aprender español - Learn Spanish",
   "from_id": "channel1055581587",
   "file": "files/Spanish_(Latin_America)_Level_2_-_Answer_Key.pdf",
   "mime_type": "application/pdf",
   "text": [
    {
     "type": "mention",
     "text": "@aprenderespanol"
    }
   ],
   "text_entities": [
    {
     "type": "mention",
     "text": "@aprenderespanol"
    }
   ]
  },
  {
   "id": 71,
   "type": "message",
   "date": "2016-07-26T07:40:04",
   "date_unixtime": "1469493604",
   "edited": "2016-07-26T07:54:09",
   "edited_unixtime": "1469494449",
   "from": "Aprender español - Learn Spanish",
   "from_id": "channel1055581587",
   "file": "files/Spanish_(Latin_America)_Level_3_-_Student_Workbook.pdf",
   "mime_type": "application/pdf",
   "text": [
    "Rosetta Stone Spanish Workbook Level 3 + Answer Key ",
    {
     "type": "hashtag",
     "text": "#book"
    },
    "  ",
    {
     "type": "mention",
     "text": "@aprenderespanol"
    }
   ],
   "text_entities": [
    {
     "type": "plain",
     "text": "Rosetta Stone Spanish Workbook Level 3 + Answer Key "
    },
    {
     "type": "hashtag",
     "text": "#book"
    },
    {
     "type": "plain",
     "text": "  "
    },
    {
     "type": "mention",
     "text": "@aprenderespanol"
    }
   ]
  },
  {
   "id": 72,
   "type": "message",
   "date": "2016-07-26T07:41:37",
   "date_unixtime": "1469493697",
   "edited": "2016-07-26T07:54:12",
   "edited_unixtime": "1469494452",
   "from": "Aprender español - Learn Spanish",
   "from_id": "channel1055581587",
   "file": "files/Spanish_(Latin_America)_Level_3_-_Answer_Key.pdf",
   "mime_type": "application/pdf",
   "text": [
    {
     "type": "mention",
     "text": "@aprenderespanol"
    }
   ],
   "text_entities": [
    {
     "type": "mention",
     "text": "@aprenderespanol"
    }
   ]
  },
  {
   "id": 73,
   "type": "message",
   "date": "2016-07-26T07:43:26",
   "date_unixtime": "1469493806",
   "edited": "2016-07-26T07:57:09",
   "edited_unixtime": "1469494629",
   "from": "Aprender español - Learn Spanish",
   "from_id": "channel1055581587",
   "photo": "photos/photo_16@26-07-2016_07-43-26.jpg",
   "width": 600,
   "height": 717,
   "text": "Check out the workbooks on this channel. Spanish level 1 to 5",
   "text_entities": [
    {
     "type": "plain",
     "text": "Check out the workbooks on this channel. Spanish level 1 to 5"
    }
   ]
  },
  {
   "id": 74,
   "type": "message",
   "date": "2016-07-26T07:47:43",
   "date_unixtime": "1469494063",
   "edited": "2016-07-26T07:54:20",
   "edited_unixtime": "1469494460",
   "from": "Aprender español - Learn Spanish",
   "from_id": "channel1055581587",
   "file": "files/Spanish_(Latin_America)_Level_3_-_Student_Workbook (1).pdf",
   "mime_type": "application/pdf",
   "text": [
    "Rosetta Stone Spanish Level 4 Workbook + answer key ",
    {
     "type": "hashtag",
     "text": "#book"
    },
    "  ",
    {
     "type": "mention",
     "text": "@aprenderespanol"
    }
   ],
   "text_entities": [
    {
     "type": "plain",
     "text": "Rosetta Stone Spanish Level 4 Workbook + answer key "
    },
    {
     "type": "hashtag",
     "text": "#book"
    },
    {
     "type": "plain",
     "text": "  "
    },
    {
     "type": "mention",
     "text": "@aprenderespanol"
    }
   ]
  },
  {
   "id": 75,
   "type": "message",
   "date": "2016-07-26T07:49:20",
   "date_unixtime": "1469494160",
   "edited": "2016-07-26T07:54:24",
   "edited_unixtime": "1469494464",
   "from": "Aprender español - Learn Spanish",
   "from_id": "channel1055581587",
   "file": "files/Spanish_(Latin_America)_Level_4_-_Answer_Key.pdf",
   "mime_type": "application/pdf",
   "text": [
    {
     "type": "mention",
     "text": "@aprenderespanol"
    }
   ],
   "text_entities": [
    {
     "type": "mention",
     "text": "@aprenderespanol"
    }
   ]
  },
  {
   "id": 76,
   "type": "message",
   "date": "2016-07-26T07:54:20",
   "date_unixtime": "1469494460",
   "edited": "2016-07-26T07:54:49",
   "edited_unixtime": "1469494489",
   "from": "Aprender español - Learn Spanish",
   "from_id": "channel1055581587",
   "file": "files/Spanish_(Latin_America)_Level_5_-_Student_Workbook.pdf",
   "mime_type": "application/pdf",
   "text": [
    "Rosetta Stone Spanish Level 5 Workbook + answer key ",
    {
     "type": "hashtag",
     "text": "#book"
    },
    "  ",
    {
     "type": "mention",
     "text": "@aprenderespanol"
    }
   ],
   "text_entities": [
    {
     "type": "plain",
     "text": "Rosetta Stone Spanish Level 5 Workbook + answer key "
    },
    {
     "type": "hashtag",
     "text": "#book"
    },
    {
     "type": "plain",
     "text": "  "
    },
    {
     "type": "mention",
     "text": "@aprenderespanol"
    }
   ]
  },
  {
   "id": 77,
   "type": "message",
   "date": "2016-07-26T07:56:03",
   "date_unixtime": "1469494563",
   "edited": "2016-07-26T07:56:31",
   "edited_unixtime": "1469494591",
   "from": "Aprender español - Learn Spanish",
   "from_id": "channel1055581587",
   "file": "files/Spanish_(Latin_America)_Level_5_-_Answer_Key.pdf",
   "mime_type": "application/pdf",
   "text": [
    {
     "type": "mention",
     "text": "@aprenderespanol"
    }
   ],
   "text_entities": [
    {
     "type": "mention",
     "text": "@aprenderespanol"
    }
   ]
  },
  {
   "id": 78,
   "type": "message",
   "date": "2016-07-28T21:54:45",
   "date_unixtime": "1469717685",
   "from": "Aprender español - Learn Spanish",
   "from_id": "channel1055581587",
   "forwarded_from": "[Canal] 🎯 Respuestas a preguntas sobre el español 🎯",
   "text": "🔰 Masculino o femenino (1)🔰\n\n⚠️ Todas las palabras que acaban en -ema son masculinas. ⚠️\n\nEl tema.\nEl problema.\nEl teorema.\nEl enfisema.\n\n¡Los hombres somos el problema! \n👨🏼 = ⁉️",
   "text_entities": [
    {
     "type": "plain",
     "text": "🔰 Masculino o femenino (1)🔰\n\n⚠️ Todas las palabras que acaban en -ema son masculinas. ⚠️\n\nEl tema.\nEl problema.\nEl teorema.\nEl enfisema.\n\n¡Los hombres somos el problema! \n👨🏼 = ⁉️"
    }
   ]
  },
  {
   "id": 79,
   "type": "message",
   "date": "2016-07-29T00:55:44",
   "date_unixtime": "1469728544",
   "from": "Aprender español - Learn Spanish",
   "from_id": "channel1055581587",
   "photo": "photos/photo_17@29-07-2016_00-55-44.jpg",
   "width": 498,
   "height": 686,
   "text": "",
   "text_entities": []
  },
  {
   "id": 80,
   "type": "message",
   "date": "2016-07-29T00:56:01",
   "date_unixtime": "1469728561",
   "from": "Aprender español - Learn Spanish",
   "from_id": "channel1055581587",
   "photo": "photos/photo_18@29-07-2016_00-56-01.jpg",
   "width": 720,
   "height": 960,
   "text": "",
   "text_entities": []
  },
  {
   "id": 81,
   "type": "message",
   "date": "2016-07-29T00:57:24",
   "date_unixtime": "1469728644",
   "from": "Aprender español - Learn Spanish",
   "from_id": "channel1055581587",
   "text": [
    {
     "type": "link",
     "text": "http://www.spanishlistening.org"
    },
    "\nHere you can find short videos and hear spanish native speakers pronouncing phrases."
   ],
   "text_entities": [
    {
     "type": "link",
     "text": "http://www.spanishlistening.org"
    },
    {
     "type": "plain",
     "text": "\nHere you can find short videos and hear spanish native speakers pronouncing phrases."
    }
   ]
  },
  {
   "id": 82,
   "type": "message",
   "date": "2016-07-30T20:57:47",
   "date_unixtime": "1469887067",
   "from": "Aprender español - Learn Spanish",
   "from_id": "channel1055581587",
   "text": "Here are some useful tips for some verbs and how to use them in Spanish",
   "text_entities": [
    {
     "type": "plain",
     "text": "Here are some useful tips for some verbs and how to use them in Spanish"
    }
   ]
  },
  {
   "id": 83,
   "type": "message",
   "date": "2016-07-30T20:57:57",
   "date_unixtime": "1469887077",
   "from": "Aprender español - Learn Spanish",
   "from_id": "channel1055581587",
   "photo": "photos/photo_19@30-07-2016_20-57-57.jpg",
   "width": 266,
   "height": 1280,
   "text": "",
   "text_entities": []
  },
  {
   "id": 84,
   "type": "message",
   "date": "2016-07-30T20:57:57",
   "date_unixtime": "1469887077",
   "from": "Aprender español - Learn Spanish",
   "from_id": "channel1055581587",
   "photo": "photos/photo_20@30-07-2016_20-57-57.jpg",
   "width": 234,
   "height": 1280,
   "text": "",
   "text_entities": []
  },
  {
   "id": 85,
   "type": "message",
   "date": "2016-07-30T20:57:57",
   "date_unixtime": "1469887077",
   "from": "Aprender español - Learn Spanish",
   "from_id": "channel1055581587",
   "photo": "photos/photo_21@30-07-2016_20-57-57.jpg",
   "width": 229,
   "height": 1280,
   "text": "",
   "text_entities": []
  },
  {
   "id": 86,
   "type": "message",
   "date": "2016-07-30T20:57:57",
   "date_unixtime": "1469887077",
   "from": "Aprender español - Learn Spanish",
   "from_id": "channel1055581587",
   "photo": "photos/photo_22@30-07-2016_20-57-57.jpg",
   "width": 225,
   "height": 1280,
   "text": "",
   "text_entities": []
  },
  {
   "id": 87,
   "type": "message",
   "date": "2016-07-30T20:57:57",
   "date_unixtime": "1469887077",
   "from": "Aprender español - Learn Spanish",
   "from_id": "channel1055581587",
   "photo": "photos/photo_23@30-07-2016_20-57-57.jpg",
   "width": 212,
   "height": 1280,
   "text": "",
   "text_entities": []
  },
  {
   "id": 88,
   "type": "message",
   "date": "2016-07-30T20:57:57",
   "date_unixtime": "1469887077",
   "from": "Aprender español - Learn Spanish",
   "from_id": "channel1055581587",
   "photo": "photos/photo_24@30-07-2016_20-57-57.jpg",
   "width": 268,
   "height": 1280,
   "text": "",
   "text_entities": []
  },
  {
   "id": 89,
   "type": "message",
   "date": "2016-08-12T05:41:23",
   "date_unixtime": "1470955283",
   "from": "Aprender español - Learn Spanish",
   "from_id": "channel1055581587",
   "photo": "photos/photo_25@12-08-2016_05-41-23.jpg",
   "width": 882,
   "height": 1280,
   "text": "",
   "text_entities": []
  },
  {
   "id": 90,
   "type": "message",
   "date": "2016-08-12T05:41:56",
   "date_unixtime": "1470955316",
   "from": "Aprender español - Learn Spanish",
   "from_id": "channel1055581587",
   "file": "files/Easy Spanish Step-by-Step.pdf",
   "mime_type": "application/pdf",
   "text": "",
   "text_entities": []
  },
  {
   "id": 91,
   "type": "message",
   "date": "2016-08-12T05:42:11",
   "date_unixtime": "1470955331",
   "from": "Aprender español - Learn Spanish",
   "from_id": "channel1055581587",
   "photo": "photos/photo_26@12-08-2016_05-42-11.jpg",
   "width": 995,
   "height": 1280,
   "text": "",
   "text_entities": []
  },
  {
   "id": 92,
   "type": "message",
   "date": "2016-08-12T05:42:23",
   "date_unixtime": "1470955343",
   "from": "Aprender español - Learn Spanish",
   "from_id": "channel1055581587",
   "file": "files/Practice_Makes_Perfect_Complete_Spanish_Grammar.pdf",
   "mime_type": "application/pdf",
   "text": "",
   "text_entities": []
  },
  {
   "id": 93,
   "type": "message",
   "date": "2016-08-12T05:42:37",
   "date_unixtime": "1470955357",
   "from": "Aprender español - Learn Spanish",
   "from_id": "channel1055581587",
   "photo": "photos/photo_27@12-08-2016_05-42-37.jpg",
   "width": 1000,
   "height": 1280,
   "text": "",
   "text_entities": []
  },
  {
   "id": 94,
   "type": "message",
   "date": "2016-08-12T05:42:45",
   "date_unixtime": "1470955365",
   "from": "Aprender español - Learn Spanish",
   "from_id": "channel1055581587",
   "file": "files/Webster_s.New.World.Spanish.Grammar.Handbook.3HAXAP.pdf",
   "mime_type": "application/pdf",
   "text": "",
   "text_entities": []
  },
  {
   "id": 95,
   "type": "message",
   "date": "2016-08-23T02:20:33",
   "date_unixtime": "1471893633",
   "from": "Aprender español - Learn Spanish",
   "from_id": "channel1055581587",
   "file": "files/real academia - gramatica castellana2008.pdf",
   "mime_type": "application/pdf",
   "text": "",
   "text_entities": []
  },
  {
   "id": 96,
   "type": "message",
   "date": "2016-08-23T02:20:54",
   "date_unixtime": "1471893654",
   "from": "Aprender español - Learn Spanish",
   "from_id": "channel1055581587",
   "file": "files/Modern Spanish Grammar.pdf",
   "mime_type": "application/pdf",
   "text": "",
   "text_entities": []
  },
  {
   "id": 97,
   "type": "message",
   "date": "2016-08-23T02:20:54",
   "date_unixtime": "1471893654",
   "from": "Aprender español - Learn Spanish",
   "from_id": "channel1055581587",
   "file": "files/Intermediate Spanish.pdf",
   "mime_type": "application/pdf",
   "text": "",
   "text_entities": []
  },
  {
   "id": 98,
   "type": "message",
   "date": "2016-08-23T02:20:54",
   "date_unixtime": "1471893654",
   "from": "Aprender español - Learn Spanish",
   "from_id": "channel1055581587",
   "file": "files/Frequency dictionary spanish.pdf",
   "mime_type": "application/pdf",
   "text": "",
   "text_entities": []
  },
  {
   "id": 99,
   "type": "message",
   "date": "2016-08-23T02:20:54",
   "date_unixtime": "1471893654",
   "from": "Aprender español - Learn Spanish",
   "from_id": "channel1055581587",
   "file": "files/Colloquial Latin American Spanish 2.pdf",
   "mime_type": "application/pdf",
   "text": "",
   "text_entities": []
  },
  {
   "id": 100,
   "type": "message",
   "date": "2016-09-12T08:10:48",
   "date_unixtime": "1473642648",
   "edited": "2016-09-12T09:55:50",
   "edited_unixtime": "1473648950",
   "from": "Aprender español - Learn Spanish",
   "from_id": "channel1055581587",
   "photo": "photos/photo_28@12-09-2016_08-10-48.jpg",
   "width": 720,
   "height": 622,
   "text": "Visual english-spanish dictionary",
   "text_entities": [
    {
     "type": "plain",
     "text": "Visual english-spanish dictionary"
    }
   ]
  },
  {
   "id": 101,
   "type": "message",
   "date": "2016-09-12T08:57:03",
   "date_unixtime": "1473645423",
   "edited": "2016-09-12T09:55:26",
   "edited_unixtime": "1473648926",
   "from": "Aprender español - Learn Spanish",
   "from_id": "channel1055581587",
   "file": "(File exceeds maximum size. Change data exporting settings to download.)",
   "mime_type": "application/pdf",
   "text": "Diccionario visual inglés-español\nVisual english-spanish dictionary",
   "text_entities": [
    {
     "type": "plain",
     "text": "Diccionario visual inglés-español\nVisual english-spanish dictionary"
    }
   ]
  },
  {
   "id": 103,
   "type": "message",
   "date": "2016-09-12T09:52:35",
   "date_unixtime": "1473648755",
   "edited": "2016-09-12T09:53:21",
   "edited_unixtime": "1473648801",
   "from": "Aprender español - Learn Spanish",
   "from_id": "channel1055581587",
   "file": "files/Basic_Spanish_A_Grammar_And_Workbook.pdf",
   "mime_type": "application/pdf",
   "text": "Basic Spanish Grammar and Workbook 📒📙",
   "text_entities": [
    {
     "type": "plain",
     "text": "Basic Spanish Grammar and Workbook 📒📙"
    }
   ]
  },
  {
   "id": 104,
   "type": "message",
   "date": "2016-09-13T05:56:19",
   "date_unixtime": "1473720979",
   "from": "Aprender español - Learn Spanish",
   "from_id": "channel1055581587",
   "forwarded_from": "Jorge.G",
   "photo": "photos/photo_29@13-09-2016_05-56-19.jpg",
   "width": 756,
   "height": 649,
   "text": "",
   "text_entities": []
  },
  {
   "id": 105,
   "type": "message",
   "date": "2016-09-27T02:36:06",
   "date_unixtime": "1474918566",
   "from": "Aprender español - Learn Spanish",
   "from_id": "channel1055581587",
   "text": [
    "Explicación sobre cuándo usar subjuntivo con \"aunque\".\n\n",
    {
     "type": "link",
     "text": "http://www.habla.pl/2016/09/26/aunque-con-indicativo-o-con-subjuntivo/"
    },
    ""
   ],
   "text_entities": [
    {
     "type": "plain",
     "text": "Explicación sobre cuándo usar subjuntivo con \"aunque\".\n\n"
    },
    {
     "type": "link",
     "text": "http://www.habla.pl/2016/09/26/aunque-con-indicativo-o-con-subjuntivo/"
    },
    {
     "type": "plain",
     "text": ""
    }
   ]
  },
  {
   "id": 106,
   "type": "message",
   "date": "2016-09-27T22:48:34",
   "date_unixtime": "1474991314",
   "from": "Aprender español - Learn Spanish",
   "from_id": "channel1055581587",
   "text": [
    "📚💿 Colloquial Spanish for beginners (book with audio).\n Download it here: ",
    {
     "type": "link",
     "text": "https://my.pcloud.com/publink/show?code=XZwiu1Zb9q90IXBFISvy5ncvFIfAuDxvJrX"
    },
    ""
   ],
   "text_entities": [
    {
     "type": "plain",
     "text": "📚💿 Colloquial Spanish for beginners (book with audio).\n Download it here: "
    },
    {
     "type": "link",
     "text": "https://my.pcloud.com/publink/show?code=XZwiu1Zb9q90IXBFISvy5ncvFIfAuDxvJrX"
    },
    {
     "type": "plain",
     "text": ""
    }
   ]
  },
  {
   "id": 107,
   "type": "message",
   "date": "2016-09-30T04:41:27",
   "date_unixtime": "1475185287",
   "from": "Aprender español - Learn Spanish",
   "from_id": "channel1055581587",
   "photo": "photos/photo_30@30-09-2016_04-41-27.jpg",
   "width": 800,
   "height": 1228,
   "text": "",
   "text_entities": []
  },
  {
   "id": 108,
   "type": "message",
   "date": "2016-10-15T01:30:34",
   "date_unixtime": "1476469834",
   "from": "Aprender español - Learn Spanish",
   "from_id": "channel1055581587",
   "text": [
    "Canciones con gramática para practicar (listado)\n\n",
    {
     "type": "link",
     "text": "https://drive.google.com/file/d/0Bwd9pONiphu0ak5oenI1TE1MZ0E/view?usp=sharing"
    },
    ""
   ],
   "text_entities": [
    {
     "type": "plain",
     "text": "Canciones con gramática para practicar (listado)\n\n"
    },
    {
     "type": "link",
     "text": "https://drive.google.com/file/d/0Bwd9pONiphu0ak5oenI1TE1MZ0E/view?usp=sharing"
    },
    {
     "type": "plain",
     "text": ""
    }
   ]
  },
  {
   "id": 109,
   "type": "message",
   "date": "2016-10-18T13:58:23",
   "date_unixtime": "1476773903",
   "from": "Aprender español - Learn Spanish",
   "from_id": "channel1055581587",
   "text": [
    "Vocabulario. Verbos de la cocina.\n\n",
    {
     "type": "link",
     "text": "https://t.co/ylvKKRCBvY"
    }
   ],
   "text_entities": [
    {
     "type": "plain",
     "text": "Vocabulario. Verbos de la cocina.\n\n"
    },
    {
     "type": "link",
     "text": "https://t.co/ylvKKRCBvY"
    }
   ]
  },
  {
   "id": 110,
   "type": "message",
   "date": "2016-10-19T04:18:42",
   "date_unixtime": "1476825522",
   "from": "Aprender español - Learn Spanish",
   "from_id": "channel1055581587",
   "photo": "photos/photo_31@19-10-2016_04-18-42.jpg",
   "width": 736,
   "height": 714,
   "text": "",
   "text_entities": []
  },
  {
   "id": 111,
   "type": "message",
   "date": "2016-10-26T23:18:58",
   "date_unixtime": "1477498738",
   "edited": "2016-10-26T23:19:15",
   "edited_unixtime": "1477498755",
   "from": "Aprender español - Learn Spanish",
   "from_id": "channel1055581587",
   "text": [
    "A2/B1\nActividades sobre El Día de Muertos\n\n",
    {
     "type": "link",
     "text": "http://www.profedeele.es/cultura/dia-muertos-mexico/"
    },
    ""
   ],
   "text_entities": [
    {
     "type": "plain",
     "text": "A2/B1\nActividades sobre El Día de Muertos\n\n"
    },
    {
     "type": "link",
     "text": "http://www.profedeele.es/cultura/dia-muertos-mexico/"
    },
    {
     "type": "plain",
     "text": ""
    }
   ]
  },
  {
   "id": 112,
   "type": "message",
   "date": "2016-11-05T01:43:03",
   "date_unixtime": "1478284983",
   "from": "Aprender español - Learn Spanish",
   "from_id": "channel1055581587",
   "text": [
    "Palabras en español con dibujo que explica y traducción al inglés.\n\n",
    {
     "type": "link",
     "text": "http://spanglishforgringos.com/"
    },
    ""
   ],
   "text_entities": [
    {
     "type": "plain",
     "text": "Palabras en español con dibujo que explica y traducción al inglés.\n\n"
    },
    {
     "type": "link",
     "text": "http://spanglishforgringos.com/"
    },
    {
     "type": "plain",
     "text": ""
    }
   ]
  },
  {
   "id": 113,
   "type": "message",
   "date": "2016-11-08T00:55:32",
   "date_unixtime": "1478541332",
   "from": "Aprender español - Learn Spanish",
   "from_id": "channel1055581587",
   "text": [
    "Manual de preparación al DELE A1 (no audio)\n",
    {
     "type": "link",
     "text": "http://ksiegarniahiszpanska.pl/2430-2489-home/el-cronometro-nivel-a1.jpg"
    },
    ""
   ],
   "text_entities": [
    {
     "type": "plain",
     "text": "Manual de preparación al DELE A1 (no audio)\n"
    },
    {
     "type": "link",
     "text": "http://ksiegarniahiszpanska.pl/2430-2489-home/el-cronometro-nivel-a1.jpg"
    },
    {
     "type": "plain",
     "text": ""
    }
   ]
  },
  {
   "id": 114,
   "type": "message",
   "date": "2016-11-08T00:56:50",
   "date_unixtime": "1478541410",
   "from": "Aprender español - Learn Spanish",
   "from_id": "channel1055581587",
   "file": "(File exceeds maximum size. Change data exporting settings to download.)",
   "mime_type": "application/pdf",
   "text": "",
   "text_entities": []
  },
  {
   "id": 115,
   "type": "message",
   "date": "2016-11-08T01:02:58",
   "date_unixtime": "1478541778",
   "from": "Aprender español - Learn Spanish",
   "from_id": "channel1055581587",
   "text": [
    "Destino DELE B1 (PDF + ZIP audios)\n",
    {
     "type": "link",
     "text": "https://goo.gl/Ob0grg"
    },
    "\n🎯 Compra: ",
    {
     "type": "link",
     "text": "http://amzn.to/2efNkVO"
    },
    "\n👾 Descarga:"
   ],
   "text_entities": [
    {
     "type": "plain",
     "text": "Destino DELE B1 (PDF + ZIP audios)\n"
    },
    {
     "type": "link",
     "text": "https://goo.gl/Ob0grg"
    },
    {
     "type": "plain",
     "text": "\n🎯 Compra: "
    },
    {
     "type": "link",
     "text": "http://amzn.to/2efNkVO"
    },
    {
     "type": "plain",
     "text": "\n👾 Descarga:"
    }
   ]
  },
  {
   "id": 116,
   "type": "message",
   "date": "2016-11-08T01:06:16",
   "date_unixtime": "1478541976",
   "from": "Aprender español - Learn Spanish",
   "from_id": "channel1055581587",
   "file": "(File exceeds maximum size. Change data exporting settings to download.)",
   "mime_type": "application/pdf",
   "text": "",
   "text_entities": []
  },
  {
   "id": 117,
   "type": "message",
   "date": "2016-11-08T01:08:27",
   "date_unixtime": "1478542107",
   "from": "Aprender español - Learn Spanish",
   "from_id": "channel1055581587",
   "file": "(File exceeds maximum size. Change data exporting settings to download.)",
   "mime_type": "application/zip",
   "text": "",
   "text_entities": []
  },
  {
   "id": 118,
   "type": "message",
   "date": "2016-11-08T01:09:03",
   "date_unixtime": "1478542143",
   "from": "Aprender español - Learn Spanish",
   "from_id": "channel1055581587",
   "text": [
    "Meta ELE final 2 (PDF + Zip audios)\n",
    {
     "type": "link",
     "text": "https://goo.gl/Vc09cU"
    },
    "\n🎯 Compra: ",
    {
     "type": "link",
     "text": "http://amzn.to/2eG2yCd"
    },
    "\n👾 Descarga:"
   ],
   "text_entities": [
    {
     "type": "plain",
     "text": "Meta ELE final 2 (PDF + Zip audios)\n"
    },
    {
     "type": "link",
     "text": "https://goo.gl/Vc09cU"
    },
    {
     "type": "plain",
     "text": "\n🎯 Compra: "
    },
    {
     "type": "link",
     "text": "http://amzn.to/2eG2yCd"
    },
    {
     "type": "plain",
     "text": "\n👾 Descarga:"
    }
   ]
  },
  {
   "id": 119,
   "type": "message",
   "date": "2016-11-08T01:10:51",
   "date_unixtime": "1478542251",
   "from": "Aprender español - Learn Spanish",
   "from_id": "channel1055581587",
   "file": "(File exceeds maximum size. Change data exporting settings to download.)",
   "mime_type": "application/pdf",
   "text": "",
   "text_entities": []
  },
  {
   "id": 120,
   "type": "message",
   "date": "2016-11-08T01:10:53",
   "date_unixtime": "1478542253",
   "from": "Aprender español - Learn Spanish",
   "from_id": "channel1055581587",
   "file": "files/Meta_ELE_2_Modelos_de_examen.pdf",
   "mime_type": "application/pdf",
   "text": "",
   "text_entities": []
  },
  {
   "id": 121,
   "type": "message",
   "date": "2016-11-08T01:10:55",
   "date_unixtime": "1478542255",
   "from": "Aprender español - Learn Spanish",
   "from_id": "channel1055581587",
   "file": "files/Meta_ELE_Final2_Transcripciones.pdf",
   "mime_type": "application/pdf",
   "text": "",
   "text_entities": []
  },
  {
   "id": 122,
   "type": "message",
   "date": "2016-11-08T01:12:37",
   "date_unixtime": "1478542357",
   "from": "Aprender español - Learn Spanish",
   "from_id": "channel1055581587",
   "file": "(File exceeds maximum size. Change data exporting settings to download.)",
   "mime_type": "application/zip",
   "text": "",
   "text_entities": []
  },
  {
   "id": 123,
   "type": "message",
   "date": "2016-11-10T21:13:52",
   "date_unixtime": "1478787232",
   "edited": "2016-11-11T03:05:35",
   "edited_unixtime": "1478808335",
   "from": "Aprender español - Learn Spanish",
   "from_id": "channel1055581587",
   "text": [
    "El verbo poner no siempre es \"to put\".\nSerie de ejemplos para entender mejor sus significados.\n\n",
    {
     "type": "link",
     "text": "http://www.habla.pl/2016/11/06/que-me-pongo-usos-del-verbo-poner-1/"
    }
   ],
   "text_entities": [
    {
     "type": "plain",
     "text": "El verbo poner no siempre es \"to put\".\nSerie de ejemplos para entender mejor sus significados.\n\n"
    },
    {
     "type": "link",
     "text": "http://www.habla.pl/2016/11/06/que-me-pongo-usos-del-verbo-poner-1/"
    }
   ]
  },
  {
   "id": 124,
   "type": "message",
   "date": "2016-11-11T20:39:51",
   "date_unixtime": "1478871591",
   "from": "Aprender español - Learn Spanish",
   "from_id": "channel1055581587",
   "text": [
    "Hoy que ha muerto Leonard Cohen, recordamos esta entrada sobre su conexión con Federico García Lorca.\n\n",
    {
     "type": "link",
     "text": "http://www.habla.pl/2015/08/25/el-pequeno-vals-vienes-de-lorca-y-leonard-cohen/"
    },
    ""
   ],
   "text_entities": [
    {
     "type": "plain",
     "text": "Hoy que ha muerto Leonard Cohen, recordamos esta entrada sobre su conexión con Federico García Lorca.\n\n"
    },
    {
     "type": "link",
     "text": "http://www.habla.pl/2015/08/25/el-pequeno-vals-vienes-de-lorca-y-leonard-cohen/"
    },
    {
     "type": "plain",
     "text": ""
    }
   ]
  },
  {
   "id": 125,
   "type": "message",
   "date": "2016-11-13T13:34:07",
   "date_unixtime": "1479018847",
   "from": "Aprender español - Learn Spanish",
   "from_id": "channel1055581587",
   "forwarded_from": "APK Downloader",
   "file": "files/com.spanishdict.spanishdict.apk",
   "mime_type": "application/vnd.android.package-archive",
   "text": "",
   "text_entities": []
  },
  {
   "id": 126,
   "type": "message",
   "date": "2016-11-28T00:39:41",
   "date_unixtime": "1480268381",
   "from": "Aprender español - Learn Spanish",
   "from_id": "channel1055581587",
   "forwarded_from": "Bayo",
   "file": "files/Spanish_Grammar,_Modern_A_Practical.pdf",
   "mime_type": "application/pdf",
   "text": "",
   "text_entities": []
  },
  {
   "id": 127,
   "type": "message",
   "date": "2016-11-28T00:53:17",
   "date_unixtime": "1480269197",
   "from": "Aprender español - Learn Spanish",
   "from_id": "channel1055581587",
   "text": [
    {
     "type": "link",
     "text": "https://youtu.be/9gy1HUbJmOw"
    }
   ],
   "text_entities": [
    {
     "type": "link",
     "text": "https://youtu.be/9gy1HUbJmOw"
    }
   ]
  },
  {
   "id": 128,
   "type": "message",
   "date": "2016-12-02T04:02:51",
   "date_unixtime": "1480626171",
   "from": "Aprender español - Learn Spanish",
   "from_id": "channel1055581587",
   "text": [
    "Hoy en Revista Habla: \"El capitán Alatriste, de Arturo Pérez-Reverte\".\nHablamos del autor, la serie de novelas y ofrecemos el PDF de la introducción y el primer capítulo, edición anotada para entender todas las referencias.\n",
    {
     "type": "link",
     "text": "https://t.co/CuL4y1ajmH"
    },
    ""
   ],
   "text_entities": [
    {
     "type": "plain",
     "text": "Hoy en Revista Habla: \"El capitán Alatriste, de Arturo Pérez-Reverte\".\nHablamos del autor, la serie de novelas y ofrecemos el PDF de la introducción y el primer capítulo, edición anotada para entender todas las referencias.\n"
    },
    {
     "type": "link",
     "text": "https://t.co/CuL4y1ajmH"
    },
    {
     "type": "plain",
     "text": ""
    }
   ]
  },
  {
   "id": 131,
   "type": "message",
   "date": "2016-12-02T08:35:11",
   "date_unixtime": "1480642511",
   "from": "Aprender español - Learn Spanish",
   "from_id": "channel1055581587",
   "photo": "photos/photo_32@02-12-2016_08-35-11.jpg",
   "width": 720,
   "height": 720,
   "text": "",
   "text_entities": []
  },
  {
   "id": 132,
   "type": "message",
   "date": "2016-12-02T08:35:23",
   "date_unixtime": "1480642523",
   "from": "Aprender español - Learn Spanish",
   "from_id": "channel1055581587",
   "photo": "photos/photo_33@02-12-2016_08-35-23.jpg",
   "width": 720,
   "height": 720,
   "text": "",
   "text_entities": []
  },
  {
   "id": 133,
   "type": "message",
   "date": "2016-12-02T08:35:31",
   "date_unixtime": "1480642531",
   "from": "Aprender español - Learn Spanish",
   "from_id": "channel1055581587",
   "photo": "photos/photo_34@02-12-2016_08-35-31.jpg",
   "width": 720,
   "height": 720,
   "text": "",
   "text_entities": []
  },
  {
   "id": 134,
   "type": "message",
   "date": "2016-12-02T08:35:39",
   "date_unixtime": "1480642539",
   "from": "Aprender español - Learn Spanish",
   "from_id": "channel1055581587",
   "photo": "photos/photo_35@02-12-2016_08-35-39.jpg",
   "width": 720,
   "height": 720,
   "text": "",
   "text_entities": []
  },
  {
   "id": 135,
   "type": "message",
   "date": "2016-12-02T08:36:30",
   "date_unixtime": "1480642590",
   "from": "Aprender español - Learn Spanish",
   "from_id": "channel1055581587",
   "photo": "photos/photo_36@02-12-2016_08-36-30.jpg",
   "width": 720,
   "height": 720,
   "text": "",
   "text_entities": []
  },
  {
   "id": 137,
   "type": "message",
   "date": "2016-12-02T08:56:44",
   "date_unixtime": "1480643804",
   "from": "Aprender español - Learn Spanish",
   "from_id": "channel1055581587",
   "text": [
    {
     "type": "link",
     "text": "http://m.mentalfloss.com/article.php?id=57195"
    }
   ],
   "text_entities": [
    {
     "type": "link",
     "text": "http://m.mentalfloss.com/article.php?id=57195"
    }
   ]
  },
  {
   "id": 138,
   "type": "message",
   "date": "2016-12-04T10:53:01",
   "date_unixtime": "1480823581",
   "from": "Aprender español - Learn Spanish",
   "from_id": "channel1055581587",
   "photo": "photos/photo_37@04-12-2016_10-53-01.jpg",
   "width": 536,
   "height": 480,
   "text": "",
   "text_entities": []
  },
  {
   "id": 139,
   "type": "message",
   "date": "2016-12-04T10:53:06",
   "date_unixtime": "1480823586",
   "from": "Aprender español - Learn Spanish",
   "from_id": "channel1055581587",
   "photo": "photos/photo_38@04-12-2016_10-53-06.jpg",
   "width": 736,
   "height": 646,
   "text": "",
   "text_entities": []
  },
  {
   "id": 140,
   "type": "message",
   "date": "2016-12-04T10:53:08",
   "date_unixtime": "1480823588",
   "from": "Aprender español - Learn Spanish",
   "from_id": "channel1055581587",
   "photo": "photos/photo_39@04-12-2016_10-53-08.jpg",
   "width": 736,
   "height": 621,
   "text": "",
   "text_entities": []
  },
  {
   "id": 141,
   "type": "message",
   "date": "2017-01-07T04:02:39",
   "date_unixtime": "1483736559",
   "from": "Aprender español - Learn Spanish",
   "from_id": "channel1055581587",
   "text": [
    "Biblioteca de libros en español gratis.\n\nMás de *dos mil* libros. Formato PDF y ePUB.\n\nSon obras libres de derechos, clásicos españoles, americanos e internacionales (traducidos al español).\n\n",
    {
     "type": "link",
     "text": "http://www.ataun.net/BIBLIOTECAGRATUITA/indice.html"
    },
    ""
   ],
   "text_entities": [
    {
     "type": "plain",
     "text": "Biblioteca de libros en español gratis.\n\nMás de *dos mil* libros. Formato PDF y ePUB.\n\nSon obras libres de derechos, clásicos españoles, americanos e internacionales (traducidos al español).\n\n"
    },
    {
     "type": "link",
     "text": "http://www.ataun.net/BIBLIOTECAGRATUITA/indice.html"
    },
    {
     "type": "plain",
     "text": ""
    }
   ]
  },
  {
   "id": 142,
   "type": "message",
   "date": "2017-01-28T08:29:55",
   "date_unixtime": "1485566995",
   "from": "Aprender español - Learn Spanish",
   "from_id": "channel1055581587",
   "photo": "photos/photo_40@28-01-2017_08-29-55.jpg",
   "width": 960,
   "height": 1280,
   "text": "",
   "text_entities": []
  },
  {
   "id": 143,
   "type": "message",
   "date": "2017-01-28T08:30:00",
   "date_unixtime": "1485567000",
   "from": "Aprender español - Learn Spanish",
   "from_id": "channel1055581587",
   "photo": "photos/photo_41@28-01-2017_08-30-00.jpg",
   "width": 960,
   "height": 1280,
   "text": "",
   "text_entities": []
  },
  {
   "id": 144,
   "type": "message",
   "date": "2017-03-01T22:23:10",
   "date_unixtime": "1488381790",
   "edited": "2020-08-17T17:13:31",
   "edited_unixtime": "1597659211",
   "from": "Aprender español - Learn Spanish",
   "from_id": "channel1055581587",
   "file": "files/Basic Spanish A Grammar and Workbook.pdf",
   "mime_type": "application/pdf",
   "text": "📕 Basic Spanish. A Grammar and Workbook",
   "text_entities": [
    {
     "type": "plain",
     "text": "📕 Basic Spanish. A Grammar and Workbook"
    }
   ]
  },
  {
   "id": 145,
   "type": "message",
   "date": "2017-03-01T22:23:10",
   "date_unixtime": "1488381790",
   "from": "Aprender español - Learn Spanish",
   "from_id": "channel1055581587",
   "file": "files/A Student Grammar of Spanish.pdf",
   "mime_type": "application/pdf",
   "text": "",
   "text_entities": []
  },
  {
   "id": 146,
   "type": "message",
   "date": "2017-03-01T22:23:11",
   "date_unixtime": "1488381791",
   "from": "Aprender español - Learn Spanish",
   "from_id": "channel1055581587",
   "file": "files/Using Spanish Vocabulary.pdf",
   "mime_type": "application/pdf",
   "text": "",
   "text_entities": []
  },
  {
   "id": 147,
   "type": "message",
   "date": "2017-03-05T22:35:23",
   "date_unixtime": "1488728123",
   "from": "Aprender español - Learn Spanish",
   "from_id": "channel1055581587",
   "via_bot": "@bold",
   "text": [
    {
     "type": "bold",
     "text": "Modelos de exámenes DELE"
    },
    "\n\nSi quieres prepararte para tu examen DELE, sigue este canal para recibir modelos de examen con los que practicar.\n\n",
    {
     "type": "bold",
     "text": "Recuerda:"
    },
    " el examen actual tiene un formato diferente así que los modelos más antiguos solo sirven para practicar"
   ],
   "text_entities": [
    {
     "type": "bold",
     "text": "Modelos de exámenes DELE"
    },
    {
     "type": "plain",
     "text": "\n\nSi quieres prepararte para tu examen DELE, sigue este canal para recibir modelos de examen con los que practicar.\n\n"
    },
    {
     "type": "bold",
     "text": "Recuerda:"
    },
    {
     "type": "plain",
     "text": " el examen actual tiene un formato diferente así que los modelos más antiguos solo sirven para practicar"
    }
   ]
  },
  {
   "id": 148,
   "type": "message",
   "date": "2017-03-05T22:35:48",
   "date_unixtime": "1488728148",
   "from": "Aprender español - Learn Spanish",
   "from_id": "channel1055581587",
   "text": [
    {
     "type": "link",
     "text": "https://t.me/ModelosDELE"
    }
   ],
   "text_entities": [
    {
     "type": "link",
     "text": "https://t.me/ModelosDELE"
    }
   ]
  },
  {
   "id": 149,
   "type": "message",
   "date": "2017-03-09T02:39:05",
   "date_unixtime": "1489001945",
   "edited": "2017-03-09T02:40:05",
   "edited_unixtime": "1489002005",
   "from": "Aprender español - Learn Spanish",
   "from_id": "channel1055581587",
   "file": "files/15_microrrelatos_edinumen.pdf",
   "mime_type": "application/pdf",
   "text": "15 microrelatos de sentimientos con actividades de comprensión de lectura.",
   "text_entities": [
    {
     "type": "plain",
     "text": "15 microrelatos de sentimientos con actividades de comprensión de lectura."
    }
   ]
  },
  {
   "id": 150,
   "type": "message",
   "date": "2017-03-09T02:40:58",
   "date_unixtime": "1489002058",
   "edited": "2017-03-09T02:42:47",
   "edited_unixtime": "1489002167",
   "from": "Aprender español - Learn Spanish",
   "from_id": "channel1055581587",
   "file": "files/Entender-conversaciones-reales-compressed.pdf",
   "mime_type": "application/pdf",
   "text": "Breve guía para entender mejor el español. Para niveles avanzados, incluye notas sobre ritmo, prosodia y fonética.",
   "text_entities": [
    {
     "type": "plain",
     "text": "Breve guía para entender mejor el español. Para niveles avanzados, incluye notas sobre ritmo, prosodia y fonética."
    }
   ]
  },
  {
   "id": 151,
   "type": "message",
   "date": "2017-03-09T04:52:43",
   "date_unixtime": "1489009963",
   "from": "Aprender español - Learn Spanish",
   "from_id": "channel1055581587",
   "file": "files/stamps-1712530_960_720.jpg",
   "thumbnail": "files/stamps-1712530_960_720.jpg_thumb.jpg",
   "mime_type": "image/jpeg",
   "width": 960,
   "height": 652,
   "text": [
    "Si quieres practicar español y conocer gente, te invitamos a participar en estre proyecto mundial de amigo postal ",
    {
     "type": "bot_command",
     "text": "/penpal"
    },
    ". Solo tienes que dejar tu dirección en el siguiente formulario:"
   ],
   "text_entities": [
    {
     "type": "plain",
     "text": "Si quieres practicar español y conocer gente, te invitamos a participar en estre proyecto mundial de amigo postal "
    },
    {
     "type": "bot_command",
     "text": "/penpal"
    },
    {
     "type": "plain",
     "text": ". Solo tienes que dejar tu dirección en el siguiente formulario:"
    }
   ]
  },
  {
   "id": 152,
   "type": "message",
   "date": "2017-03-09T04:54:21",
   "date_unixtime": "1489010061",
   "from": "Aprender español - Learn Spanish",
   "from_id": "channel1055581587",
   "text": [
    {
     "type": "link",
     "text": "https://goo.gl/forms/EIMFBlRt32EG5cLt1"
    },
    "\n\nNo recopilamos datos personales.\nNo garantizamos nada, solo ponemos en contacto a gente interesada.\nLos intercambios serán en español.\nSi tienes un problema, busca a ",
    {
     "type": "mention",
     "text": "@RevistaHabla"
    },
    ""
   ],
   "text_entities": [
    {
     "type": "link",
     "text": "https://goo.gl/forms/EIMFBlRt32EG5cLt1"
    },
    {
     "type": "plain",
     "text": "\n\nNo recopilamos datos personales.\nNo garantizamos nada, solo ponemos en contacto a gente interesada.\nLos intercambios serán en español.\nSi tienes un problema, busca a "
    },
    {
     "type": "mention",
     "text": "@RevistaHabla"
    },
    {
     "type": "plain",
     "text": ""
    }
   ]
  },
  {
   "id": 153,
   "type": "message",
   "date": "2017-03-10T06:31:39",
   "date_unixtime": "1489102299",
   "edited": "2017-03-10T06:32:04",
   "edited_unixtime": "1489102324",
   "from": "Aprender español - Learn Spanish",
   "from_id": "channel1055581587",
   "file": "files/subjuntivo.pdf",
   "mime_type": "application/pdf",
   "text": "Presentación para explicar por qué tenemos subjuntivo en español y cómo podemos entender cuándo hay que usarlo.",
   "text_entities": [
    {
     "type": "plain",
     "text": "Presentación para explicar por qué tenemos subjuntivo en español y cómo podemos entender cuándo hay que usarlo."
    }
   ]
  },
  {
   "id": 154,
   "type": "message",
   "date": "2017-03-15T03:16:38",
   "date_unixtime": "1489522598",
   "from": "Aprender español - Learn Spanish",
   "from_id": "channel1055581587",
   "forwarded_from": "The Carlos Diaries",
   "text": "El jardín: (the garden) \nLas rosas - the roses \nLos pétalos - the petals \nLas flores - the flowers \nEl florero - the vase \nLas orquídeas - the orchids \nLos guantes - the gloves \nEl rastrillo - the rake \nLa manguera - the hose \nEl jarrón - the pot (like pottery) \nEl envase - container \nEnterrar - to burry \nSembrar - to plant \nPlantar - to plant ( please don't use this it's ugly) \nEl Jardinero - the gardener \nLa Jardinera - the gardener \nLa Maleza - weeds \nLa grama - grass\nEl pasto - grass \nUn terreno -terrain \nUn acre - acre \nUna hectárea - hectare \nLa cosecha - harvest \nUna sequía - a drought \nUn aguacero - a lot of rain \nUna inundación - a flood \nSeco/seca - dry \nMojado/mojada - wet \nMaduro/madura - ripe (also mature)",
   "text_entities": [
    {
     "type": "plain",
     "text": "El jardín: (the garden) \nLas rosas - the roses \nLos pétalos - the petals \nLas flores - the flowers \nEl florero - the vase \nLas orquídeas - the orchids \nLos guantes - the gloves \nEl rastrillo - the rake \nLa manguera - the hose \nEl jarrón - the pot (like pottery) \nEl envase - container \nEnterrar - to burry \nSembrar - to plant \nPlantar - to plant ( please don't use this it's ugly) \nEl Jardinero - the gardener \nLa Jardinera - the gardener \nLa Maleza - weeds \nLa grama - grass\nEl pasto - grass \nUn terreno -terrain \nUn acre - acre \nUna hectárea - hectare \nLa cosecha - harvest \nUna sequía - a drought \nUn aguacero - a lot of rain \nUna inundación - a flood \nSeco/seca - dry \nMojado/mojada - wet \nMaduro/madura - ripe (also mature)"
    }
   ]
  },
  {
   "id": 156,
   "type": "message",
   "date": "2017-03-21T07:53:48",
   "date_unixtime": "1490057628",
   "edited": "2017-03-21T07:54:52",
   "edited_unixtime": "1490057692",
   "from": "Aprender español - Learn Spanish",
   "from_id": "channel1055581587",
   "text": [
    "Canal de libros en español 📚\nNo ficción y novelas. \n",
    {
     "type": "link",
     "text": "https://telegram.me/LibrosDigital"
    },
    ""
   ],
   "text_entities": [
    {
     "type": "plain",
     "text": "Canal de libros en español 📚\nNo ficción y novelas. \n"
    },
    {
     "type": "link",
     "text": "https://telegram.me/LibrosDigital"
    },
    {
     "type": "plain",
     "text": ""
    }
   ]
  },
  {
   "id": 157,
   "type": "message",
   "date": "2017-03-23T22:14:35",
   "date_unixtime": "1490282075",
   "edited": "2017-03-23T22:15:03",
   "edited_unixtime": "1490282103",
   "from": "Aprender español - Learn Spanish",
   "from_id": "channel1055581587",
   "file": "files/prueba_de_nivel.pdf",
   "mime_type": "application/pdf",
   "text": "Test de nivel que puede ayudarte a comprobar tu nivel de español.  También como ejercicio de repaso.",
   "text_entities": [
    {
     "type": "plain",
     "text": "Test de nivel que puede ayudarte a comprobar tu nivel de español.  También como ejercicio de repaso."
    }
   ]
  },
  {
   "id": 158,
   "type": "message",
   "date": "2017-03-27T19:17:15",
   "date_unixtime": "1490617035",
   "from": "Aprender español - Learn Spanish",
   "from_id": "channel1055581587",
   "photo": "photos/photo_42@27-03-2017_19-17-15.jpg",
   "width": 940,
   "height": 788,
   "text": "",
   "text_entities": []
  },
  {
   "id": 161,
   "type": "message",
   "date": "2017-03-30T23:56:35",
   "date_unixtime": "1490892995",
   "edited": "2017-03-30T23:57:07",
   "edited_unixtime": "1490893027",
   "from": "Aprender español - Learn Spanish",
   "from_id": "channel1055581587",
   "file": "files/portada-elefante-high.gif",
   "thumbnail": "files/portada-elefante-high.gif_thumb.jpg",
   "mime_type": "image/gif",
   "width": 839,
   "height": 592,
   "text": "Manual completo de nivel B1 y B2",
   "text_entities": [
    {
     "type": "plain",
     "text": "Manual completo de nivel B1 y B2"
    }
   ]
  },
  {
   "id": 162,
   "type": "message",
   "date": "2017-03-31T00:01:38",
   "date_unixtime": "1490893298",
   "from": "Aprender español - Learn Spanish",
   "from_id": "channel1055581587",
   "file": "(File exceeds maximum size. Change data exporting settings to download.)",
   "mime_type": "application/pdf",
   "text": "740 páginas de explicaciones, gramática y ejercicios",
   "text_entities": [
    {
     "type": "plain",
     "text": "740 páginas de explicaciones, gramática y ejercicios"
    }
   ]
  },
  {
   "id": 163,
   "type": "message",
   "date": "2017-03-31T00:01:40",
   "date_unixtime": "1490893300",
   "from": "Aprender español - Learn Spanish",
   "from_id": "channel1055581587",
   "file": "files/PORTADAA-FINAL-MINI.G.jpg",
   "thumbnail": "files/PORTADAA-FINAL-MINI.G.jpg_thumb.jpg",
   "mime_type": "image/jpeg",
   "width": 867,
   "height": 625,
   "text": "Manual completo niveles A1 y A2. \n\n488 páginas de explicaciones, ejercicios y lecturas.",
   "text_entities": [
    {
     "type": "plain",
     "text": "Manual completo niveles A1 y A2. \n\n488 páginas de explicaciones, ejercicios y lecturas."
    }
   ]
  },
  {
   "id": 164,
   "type": "message",
   "date": "2017-03-31T00:05:58",
   "date_unixtime": "1490893558",
   "from": "Aprender español - Learn Spanish",
   "from_id": "channel1055581587",
   "file": "(File exceeds maximum size. Change data exporting settings to download.)",
   "mime_type": "application/pdf",
   "text": "",
   "text_entities": []
  },
  {
   "id": 165,
   "type": "message",
   "date": "2017-04-07T03:51:40",
   "date_unixtime": "1491511900",
   "from": "Aprender español - Learn Spanish",
   "from_id": "channel1055581587",
   "text": [
    "Vocabulario de la Semana Santa\n\n",
    {
     "type": "link",
     "text": "https://t.co/clgAieOc86"
    }
   ],
   "text_entities": [
    {
     "type": "plain",
     "text": "Vocabulario de la Semana Santa\n\n"
    },
    {
     "type": "link",
     "text": "https://t.co/clgAieOc86"
    }
   ]
  },
  {
   "id": 166,
   "type": "message",
   "date": "2017-04-09T04:06:14",
   "date_unixtime": "1491685574",
   "from": "Aprender español - Learn Spanish",
   "from_id": "channel1055581587",
   "photo": "photos/photo_43@09-04-2017_04-06-14.jpg",
   "width": 905,
   "height": 1280,
   "text": "",
   "text_entities": []
  },
  {
   "id": 168,
   "type": "message",
   "date": "2017-04-17T00:11:05",
   "date_unixtime": "1492362665",
   "from": "Aprender español - Learn Spanish",
   "from_id": "channel1055581587",
   "text": [
    "Canciones con gramática para practicar (listado)\n\n",
    {
     "type": "link",
     "text": "https://drive.google.com/file/d/0Bwd9pONiphu0ak5oenI1TE1MZ0E/view?usp=sharing"
    },
    ""
   ],
   "text_entities": [
    {
     "type": "plain",
     "text": "Canciones con gramática para practicar (listado)\n\n"
    },
    {
     "type": "link",
     "text": "https://drive.google.com/file/d/0Bwd9pONiphu0ak5oenI1TE1MZ0E/view?usp=sharing"
    },
    {
     "type": "plain",
     "text": ""
    }
   ]
  },
  {
   "id": 169,
   "type": "message",
   "date": "2017-04-22T15:11:20",
   "date_unixtime": "1492848680",
   "from": "Aprender español - Learn Spanish",
   "from_id": "channel1055581587",
   "text": [
    {
     "type": "link",
     "text": "https://www.buzzfeed.com/marcoschamizo/una-hostia-que-te-visto-de-torero?utm_term=.dknPnEkJB6#.ohLa2db6Nk"
    }
   ],
   "text_entities": [
    {
     "type": "link",
     "text": "https://www.buzzfeed.com/marcoschamizo/una-hostia-que-te-visto-de-torero?utm_term=.dknPnEkJB6#.ohLa2db6Nk"
    }
   ]
  },
  {
   "id": 171,
   "type": "message",
   "date": "2017-04-24T22:11:04",
   "date_unixtime": "1493046664",
   "from": "Aprender español - Learn Spanish",
   "from_id": "channel1055581587",
   "forwarded_from": "Jorge.G",
   "file": "files/SER - ESTAR (teoría).pdf",
   "mime_type": "application/pdf",
   "text": "",
   "text_entities": []
  },
  {
   "id": 172,
   "type": "message",
   "date": "2017-04-24T22:11:14",
   "date_unixtime": "1493046674",
   "from": "Aprender español - Learn Spanish",
   "from_id": "channel1055581587",
   "forwarded_from": "Jorge.G",
   "file": "files/SER - ESTAR (ejercicios).pdf",
   "mime_type": "application/pdf",
   "text": "",
   "text_entities": []
  },
  {
   "id": 173,
   "type": "message",
   "date": "2017-04-25T01:16:19",
   "date_unixtime": "1493057779",
   "from": "Aprender español - Learn Spanish",
   "from_id": "channel1055581587",
   "photo": "photos/photo_44@25-04-2017_01-16-19.jpg",
   "width": 320,
   "height": 320,
   "text": "",
   "text_entities": []
  },
  {
   "id": 174,
   "type": "message",
   "date": "2017-04-27T00:41:26",
   "date_unixtime": "1493228486",
   "edited": "2017-04-27T00:41:50",
   "edited_unixtime": "1493228510",
   "from": "Aprender español - Learn Spanish",
   "from_id": "channel1055581587",
   "text": [
    "Más modelos de examen agregados. Poco a poco recopilamos todos los exámenes posibles.\n\n 🎯 ",
    {
     "type": "link",
     "text": "https://t.me/ModelosDELE"
    },
    " 🎯"
   ],
   "text_entities": [
    {
     "type": "plain",
     "text": "Más modelos de examen agregados. Poco a poco recopilamos todos los exámenes posibles.\n\n 🎯 "
    },
    {
     "type": "link",
     "text": "https://t.me/ModelosDELE"
    },
    {
     "type": "plain",
     "text": " 🎯"
    }
   ]
  },
  {
   "id": 175,
   "type": "message",
   "date": "2017-04-29T23:23:32",
   "date_unixtime": "1493483012",
   "from": "Aprender español - Learn Spanish",
   "from_id": "channel1055581587",
   "photo": "photos/photo_45@29-04-2017_23-23-32.jpg",
   "width": 800,
   "height": 800,
   "text": "",
   "text_entities": []
  },
  {
   "id": 176,
   "type": "service",
   "date": "2017-05-02T09:23:54",
   "date_unixtime": "1493691834",
   "actor": "Aprender español - Learn Spanish",
   "actor_id": "channel1055581587",
   "action": "edit_group_photo",
   "photo": "photos/photo_46@02-05-2017_09-23-54.jpg",
   "width": 640,
   "height": 640,
   "text": "",
   "text_entities": []
  },
  {
   "id": 177,
   "type": "message",
   "date": "2017-05-03T00:52:40",
   "date_unixtime": "1493747560",
   "from": "Aprender español - Learn Spanish",
   "from_id": "channel1055581587",
   "text": [
    {
     "type": "bold",
     "text": "Imperativo"
    },
    "\n\nResumen gramatical, ejemplos y ejercicios.\n\n",
    {
     "type": "link",
     "text": "https://www.profedeele.es/gramatica/imperativo-regular-irregular/"
    }
   ],
   "text_entities": [
    {
     "type": "bold",
     "text": "Imperativo"
    },
    {
     "type": "plain",
     "text": "\n\nResumen gramatical, ejemplos y ejercicios.\n\n"
    },
    {
     "type": "link",
     "text": "https://www.profedeele.es/gramatica/imperativo-regular-irregular/"
    }
   ]
  },
  {
   "id": 178,
   "type": "message",
   "date": "2017-05-03T19:42:19",
   "date_unixtime": "1493815339",
   "from": "Aprender español - Learn Spanish",
   "from_id": "channel1055581587",
   "text": [
    {
     "type": "bold",
     "text": "Gramática: verbos"
    },
    "\n\nResumen de formas y usos de todos los tiempos verbales del español.\n\n",
    {
     "type": "link",
     "text": "http://www.xn--espaolextranjeros-ixb.com/2017/03/didactica-ele-9-repaso-tiempos-verbales.html?spref=fb&m=1"
    },
    ""
   ],
   "text_entities": [
    {
     "type": "bold",
     "text": "Gramática: verbos"
    },
    {
     "type": "plain",
     "text": "\n\nResumen de formas y usos de todos los tiempos verbales del español.\n\n"
    },
    {
     "type": "link",
     "text": "http://www.xn--espaolextranjeros-ixb.com/2017/03/didactica-ele-9-repaso-tiempos-verbales.html?spref=fb&m=1"
    },
    {
     "type": "plain",
     "text": ""
    }
   ]
  },
  {
   "id": 180,
   "type": "message",
   "date": "2017-05-03T23:21:15",
   "date_unixtime": "1493828475",
   "edited": "2017-05-03T23:22:10",
   "edited_unixtime": "1493828530",
   "from": "Aprender español - Learn Spanish",
   "from_id": "channel1055581587",
   "file": "files/espancc83ol-coloquial-para-erasmus.pdf",
   "mime_type": "application/pdf",
   "text": "Aprender español - Learn Spanish:\nEspañol coloquial para erasmus (extracto).pdf",
   "text_entities": [
    {
     "type": "plain",
     "text": "Aprender español - Learn Spanish:\nEspañol coloquial para erasmus (extracto).pdf"
    }
   ]
  },
  {
   "id": 181,
   "type": "message",
   "date": "2017-05-05T13:43:23",
   "date_unixtime": "1493966603",
   "from": "Aprender español - Learn Spanish",
   "from_id": "channel1055581587",
   "text": [
    {
     "type": "hashtag",
     "text": "#B2"
    },
    " ",
    {
     "type": "hashtag",
     "text": "#comprensiónauditiva"
    },
    "\n\n«¿Te gusta saber el tiempo que hace antes de salir de casa? Muchísima gente ve y escucha las noticias del tiempo meteorológico. Unos por interés profesional y otros por curiosidad, pero básicamente es un tema para cumplir la función fática (mantener el canal comunicativo abierto), porque si no es del tiempo ¿de qué hablas cuando te encuentras con alguien en el ascensor? ¿O antes y después de unas vacaciones?\n\nA continuación, una actividad práctica de comprensión auditiva para nuestros estudiantes de ELE de B2 (MCER)»\n\n",
    {
     "type": "link",
     "text": "http://elecreacion.com/que-tiempo-hace-hoy/"
    },
    ""
   ],
   "text_entities": [
    {
     "type": "hashtag",
     "text": "#B2"
    },
    {
     "type": "plain",
     "text": " "
    },
    {
     "type": "hashtag",
     "text": "#comprensiónauditiva"
    },
    {
     "type": "plain",
     "text": "\n\n«¿Te gusta saber el tiempo que hace antes de salir de casa? Muchísima gente ve y escucha las noticias del tiempo meteorológico. Unos por interés profesional y otros por curiosidad, pero básicamente es un tema para cumplir la función fática (mantener el canal comunicativo abierto), porque si no es del tiempo ¿de qué hablas cuando te encuentras con alguien en el ascensor? ¿O antes y después de unas vacaciones?\n\nA continuación, una actividad práctica de comprensión auditiva para nuestros estudiantes de ELE de B2 (MCER)»\n\n"
    },
    {
     "type": "link",
     "text": "http://elecreacion.com/que-tiempo-hace-hoy/"
    },
    {
     "type": "plain",
     "text": ""
    }
   ]
  },
  {
   "id": 182,
   "type": "message",
   "date": "2017-05-11T19:37:19",
   "date_unixtime": "1494506239",
   "from": "Aprender español - Learn Spanish",
   "from_id": "channel1055581587",
   "photo": "photos/photo_47@11-05-2017_19-37-19.jpg",
   "width": 600,
   "height": 540,
   "text": "",
   "text_entities": []
  },
  {
   "id": 183,
   "type": "message",
   "date": "2017-05-15T05:38:08",
   "date_unixtime": "1494801488",
   "from": "Aprender español - Learn Spanish",
   "from_id": "channel1055581587",
   "photo": "photos/photo_48@15-05-2017_05-38-08.jpg",
   "width": 905,
   "height": 1280,
   "text": "",
   "text_entities": []
  },
  {
   "id": 184,
   "type": "message",
   "date": "2017-05-15T13:56:16",
   "date_unixtime": "1494831376",
   "from": "Aprender español - Learn Spanish",
   "from_id": "channel1055581587",
   "text": [
    "Expresiones con la palabra mano. ",
    {
     "type": "bold",
     "text": "Ejercicio con soluciones"
    },
    ".\n\n",
    {
     "type": "link",
     "text": "http://www.xn--espaolextranjeros-ixb.com/2014/09/b2-c1-expresiones-con-mano.html?spref=fb&m=1"
    }
   ],
   "text_entities": [
    {
     "type": "plain",
     "text": "Expresiones con la palabra mano. "
    },
    {
     "type": "bold",
     "text": "Ejercicio con soluciones"
    },
    {
     "type": "plain",
     "text": ".\n\n"
    },
    {
     "type": "link",
     "text": "http://www.xn--espaolextranjeros-ixb.com/2014/09/b2-c1-expresiones-con-mano.html?spref=fb&m=1"
    }
   ]
  },
  {
   "id": 185,
   "type": "message",
   "date": "2017-05-17T19:28:39",
   "date_unixtime": "1495024119",
   "from": "Aprender español - Learn Spanish",
   "from_id": "channel1055581587",
   "photo": "photos/photo_49@17-05-2017_19-28-39.jpg",
   "width": 720,
   "height": 489,
   "text": "",
   "text_entities": []
  },
  {
   "id": 186,
   "type": "message",
   "date": "2017-05-17T19:50:37",
   "date_unixtime": "1495025437",
   "from": "Aprender español - Learn Spanish",
   "from_id": "channel1055581587",
   "text": [
    "Spanish pronouns explained\n",
    {
     "type": "link",
     "text": "http://users.ipfw.edu/jehle/courses/pronoun1.htm"
    }
   ],
   "text_entities": [
    {
     "type": "plain",
     "text": "Spanish pronouns explained\n"
    },
    {
     "type": "link",
     "text": "http://users.ipfw.edu/jehle/courses/pronoun1.htm"
    }
   ]
  },
  {
   "id": 187,
   "type": "message",
   "date": "2017-05-19T07:50:11",
   "date_unixtime": "1495155011",
   "from": "Aprender español - Learn Spanish",
   "from_id": "channel1055581587",
   "file": "files/Avila, Fernando - Español correcto para dummies.pdf",
   "mime_type": "application/pdf",
   "text": "",
   "text_entities": []
  },
  {
   "id": 188,
   "type": "message",
   "date": "2017-05-19T07:52:45",
   "date_unixtime": "1495155165",
   "from": "Aprender español - Learn Spanish",
   "from_id": "channel1055581587",
   "file": "(File exceeds maximum size. Change data exporting settings to download.)",
   "mime_type": "application/pdf",
   "text": "",
   "text_entities": []
  },
  {
   "id": 189,
   "type": "message",
   "date": "2017-05-19T07:56:01",
   "date_unixtime": "1495155361",
   "from": "Aprender español - Learn Spanish",
   "from_id": "channel1055581587",
   "file": "(File exceeds maximum size. Change data exporting settings to download.)",
   "mime_type": "application/pdf",
   "text": "",
   "text_entities": []
  },
  {
   "id": 190,
   "type": "message",
   "date": "2017-05-19T07:56:06",
   "date_unixtime": "1495155366",
   "from": "Aprender español - Learn Spanish",
   "from_id": "channel1055581587",
   "file": "files/Concha Moreno et al - Gramatica Nivel medio B1 ELE AnayaELE.pdf",
   "mime_type": "application/pdf",
   "text": "",
   "text_entities": []
  },
  {
   "id": 191,
   "type": "message",
   "date": "2017-05-19T07:57:50",
   "date_unixtime": "1495155470",
   "from": "Aprender español - Learn Spanish",
   "from_id": "channel1055581587",
   "file": "(File exceeds maximum size. Change data exporting settings to download.)",
   "mime_type": "application/pdf",
   "text": "",
   "text_entities": []
  },
  {
   "id": 192,
   "type": "message",
   "date": "2017-05-19T07:58:47",
   "date_unixtime": "1495155527",
   "from": "Aprender español - Learn Spanish",
   "from_id": "channel1055581587",
   "file": "files/Palomina. Vocabulario en dialogo.zip",
   "mime_type": "application/zip",
   "text": "Vocabulario en diálogo.\n\nPDF + MP3",
   "text_entities": [
    {
     "type": "plain",
     "text": "Vocabulario en diálogo.\n\nPDF + MP3"
    }
   ]
  },
  {
   "id": 193,
   "type": "message",
   "date": "2017-05-19T07:59:27",
   "date_unixtime": "1495155567",
   "from": "Aprender español - Learn Spanish",
   "from_id": "channel1055581587",
   "file": "files/Abanico B2 Libro del alumno.pdf",
   "mime_type": "application/pdf",
   "text": "",
   "text_entities": []
  },
  {
   "id": 194,
   "type": "message",
   "date": "2017-05-19T08:00:33",
   "date_unixtime": "1495155633",
   "from": "Aprender español - Learn Spanish",
   "from_id": "channel1055581587",
   "file": "files/Abanico B2 Libro de ejercicios.pdf",
   "mime_type": "application/pdf",
   "text": "",
   "text_entities": []
  },
  {
   "id": 195,
   "type": "message",
   "date": "2017-05-21T21:33:10",
   "date_unixtime": "1495377190",
   "from": "Aprender español - Learn Spanish",
   "from_id": "channel1055581587",
   "photo": "photos/photo_50@21-05-2017_21-33-10.jpg",
   "width": 444,
   "height": 201,
   "text": "",
   "text_entities": []
  },
  {
   "id": 196,
   "type": "message",
   "date": "2017-05-21T21:33:10",
   "date_unixtime": "1495377190",
   "from": "Aprender español - Learn Spanish",
   "from_id": "channel1055581587",
   "photo": "photos/photo_51@21-05-2017_21-33-10.jpg",
   "width": 446,
   "height": 174,
   "text": "",
   "text_entities": []
  },
  {
   "id": 197,
   "type": "message",
   "date": "2017-05-21T21:33:10",
   "date_unixtime": "1495377190",
   "from": "Aprender español - Learn Spanish",
   "from_id": "channel1055581587",
   "photo": "photos/photo_52@21-05-2017_21-33-10.jpg",
   "width": 444,
   "height": 174,
   "text": "",
   "text_entities": []
  },
  {
   "id": 198,
   "type": "message",
   "date": "2017-05-21T21:33:10",
   "date_unixtime": "1495377190",
   "from": "Aprender español - Learn Spanish",
   "from_id": "channel1055581587",
   "photo": "photos/photo_53@21-05-2017_21-33-10.jpg",
   "width": 445,
   "height": 172,
   "text": "",
   "text_entities": []
  },
  {
   "id": 199,
   "type": "message",
   "date": "2017-05-24T22:00:58",
   "date_unixtime": "1495638058",
   "from": "Aprender español - Learn Spanish",
   "from_id": "channel1055581587",
   "photo": "photos/photo_54@24-05-2017_22-00-58.jpg",
   "width": 594,
   "height": 731,
   "text": "",
   "text_entities": []
  },
  {
   "id": 200,
   "type": "message",
   "date": "2017-05-24T22:00:58",
   "date_unixtime": "1495638058",
   "from": "Aprender español - Learn Spanish",
   "from_id": "channel1055581587",
   "photo": "photos/photo_55@24-05-2017_22-00-58.jpg",
   "width": 594,
   "height": 689,
   "text": "",
   "text_entities": []
  },
  {
   "id": 201,
   "type": "message",
   "date": "2017-05-24T22:00:58",
   "date_unixtime": "1495638058",
   "from": "Aprender español - Learn Spanish",
   "from_id": "channel1055581587",
   "photo": "photos/photo_56@24-05-2017_22-00-58.jpg",
   "width": 594,
   "height": 709,
   "text": "",
   "text_entities": []
  },
  {
   "id": 202,
   "type": "message",
   "date": "2017-05-24T22:00:58",
   "date_unixtime": "1495638058",
   "from": "Aprender español - Learn Spanish",
   "from_id": "channel1055581587",
   "photo": "photos/photo_57@24-05-2017_22-00-58.jpg",
   "width": 594,
   "height": 725,
   "text": "",
   "text_entities": []
  },
  {
   "id": 203,
   "type": "message",
   "date": "2017-05-26T04:07:00",
   "date_unixtime": "1495746420",
   "edited": "2017-05-26T04:07:27",
   "edited_unixtime": "1495746447",
   "from": "Aprender español - Learn Spanish",
   "from_id": "channel1055581587",
   "photo": "photos/photo_58@26-05-2017_04-07-00.jpg",
   "width": 600,
   "height": 952,
   "text": "¡Feliz día del orgullo friki!",
   "text_entities": [
    {
     "type": "plain",
     "text": "¡Feliz día del orgullo friki!"
    }
   ]
  },
  {
   "id": 204,
   "type": "message",
   "date": "2017-05-29T22:10:17",
   "date_unixtime": "1496070617",
   "from": "Aprender español - Learn Spanish",
   "from_id": "channel1055581587",
   "photo": "photos/photo_59@29-05-2017_22-10-17.jpg",
   "width": 913,
   "height": 695,
   "text": "",
   "text_entities": []
  },
  {
   "id": 205,
   "type": "message",
   "date": "2017-05-31T17:48:02",
   "date_unixtime": "1496227682",
   "from": "Aprender español - Learn Spanish",
   "from_id": "channel1055581587",
   "text": [
    "Querido Subjuntivo, ¿cuándo te utilizo?\n",
    {
     "type": "link",
     "text": "https://spanishwithluna.wordpress.com/2017/05/31/querido-subjuntivo-cuando-te-utilizo/"
    },
    ""
   ],
   "text_entities": [
    {
     "type": "plain",
     "text": "Querido Subjuntivo, ¿cuándo te utilizo?\n"
    },
    {
     "type": "link",
     "text": "https://spanishwithluna.wordpress.com/2017/05/31/querido-subjuntivo-cuando-te-utilizo/"
    },
    {
     "type": "plain",
     "text": ""
    }
   ]
  },
  {
   "id": 206,
   "type": "message",
   "date": "2017-06-02T19:50:32",
   "date_unixtime": "1496407832",
   "from": "Aprender español - Learn Spanish",
   "from_id": "channel1055581587",
   "text": [
    "Origen de la lengua castellana.\n\n",
    {
     "type": "link",
     "text": "https://youtu.be/N1a0RhutJtg"
    }
   ],
   "text_entities": [
    {
     "type": "plain",
     "text": "Origen de la lengua castellana.\n\n"
    },
    {
     "type": "link",
     "text": "https://youtu.be/N1a0RhutJtg"
    }
   ]
  },
  {
   "id": 207,
   "type": "message",
   "date": "2017-06-06T00:51:08",
   "date_unixtime": "1496685068",
   "from": "Aprender español - Learn Spanish",
   "from_id": "channel1055581587",
   "text": [
    {
     "type": "link",
     "text": "https://www.thoughtco.com/keep-adverbs-close-what-they-modify-3078169"
    }
   ],
   "text_entities": [
    {
     "type": "link",
     "text": "https://www.thoughtco.com/keep-adverbs-close-what-they-modify-3078169"
    }
   ]
  },
  {
   "id": 208,
   "type": "message",
   "date": "2017-06-14T02:10:22",
   "date_unixtime": "1497381022",
   "from": "Aprender español - Learn Spanish",
   "from_id": "channel1055581587",
   "text": [
    {
     "type": "link",
     "text": "https://youtu.be/eilM72E9OPo"
    }
   ],
   "text_entities": [
    {
     "type": "link",
     "text": "https://youtu.be/eilM72E9OPo"
    }
   ]
  },
  {
   "id": 209,
   "type": "message",
   "date": "2017-06-15T05:34:12",
   "date_unixtime": "1497479652",
   "from": "Aprender español - Learn Spanish",
   "from_id": "channel1055581587",
   "photo": "photos/photo_60@15-06-2017_05-34-12.jpg",
   "width": 1182,
   "height": 886,
   "text": "",
   "text_entities": []
  },
  {
   "id": 210,
   "type": "message",
   "date": "2017-06-17T15:21:45",
   "date_unixtime": "1497687705",
   "from": "Aprender español - Learn Spanish",
   "from_id": "channel1055581587",
   "photo": "photos/photo_61@17-06-2017_15-21-45.jpg",
   "width": 960,
   "height": 1280,
   "text": "",
   "text_entities": []
  },
  {
   "id": 211,
   "type": "message",
   "date": "2017-06-19T20:13:07",
   "date_unixtime": "1497877987",
   "from": "Aprender español - Learn Spanish",
   "from_id": "channel1055581587",
   "photo": "photos/photo_62@19-06-2017_20-13-07.jpg",
   "width": 944,
   "height": 601,
   "text": "",
   "text_entities": []
  },
  {
   "id": 212,
   "type": "message",
   "date": "2017-06-19T23:06:59",
   "date_unixtime": "1497888419",
   "from": "Aprender español - Learn Spanish",
   "from_id": "channel1055581587",
   "text": [
    "News channel about Venezuela: ",
    {
     "type": "mention",
     "text": "@infoaldiavzla"
    }
   ],
   "text_entities": [
    {
     "type": "plain",
     "text": "News channel about Venezuela: "
    },
    {
     "type": "mention",
     "text": "@infoaldiavzla"
    }
   ]
  },
  {
   "id": 213,
   "type": "message",
   "date": "2017-06-21T18:03:43",
   "date_unixtime": "1498043023",
   "from": "Aprender español - Learn Spanish",
   "from_id": "channel1055581587",
   "photo": "photos/photo_63@21-06-2017_18-03-43.jpg",
   "width": 512,
   "height": 1280,
   "text": "",
   "text_entities": []
  },
  {
   "id": 214,
   "type": "message",
   "date": "2017-06-24T16:49:28",
   "date_unixtime": "1498297768",
   "from": "Aprender español - Learn Spanish",
   "from_id": "channel1055581587",
   "text": [
    "Un poco de historia sobre la noche de San Juan.\n\n",
    {
     "type": "link",
     "text": "http://www.spanishcoursessalamanca.com/en/spanish-traditions-en/tradicion-de-la-noche-de-san-juan/"
    }
   ],
   "text_entities": [
    {
     "type": "plain",
     "text": "Un poco de historia sobre la noche de San Juan.\n\n"
    },
    {
     "type": "link",
     "text": "http://www.spanishcoursessalamanca.com/en/spanish-traditions-en/tradicion-de-la-noche-de-san-juan/"
    }
   ]
  },
  {
   "id": 215,
   "type": "message",
   "date": "2017-07-04T18:42:46",
   "date_unixtime": "1499168566",
   "from": "Aprender español - Learn Spanish",
   "from_id": "channel1055581587",
   "photo": "photos/photo_64@04-07-2017_18-42-46.jpg",
   "width": 1280,
   "height": 960,
   "text": "",
   "text_entities": []
  },
  {
   "id": 216,
   "type": "message",
   "date": "2017-07-05T06:29:50",
   "date_unixtime": "1499210990",
   "from": "Aprender español - Learn Spanish",
   "from_id": "channel1055581587",
   "photo": "photos/photo_65@05-07-2017_06-29-50.jpg",
   "width": 960,
   "height": 720,
   "text": "",
   "text_entities": []
  },
  {
   "id": 217,
   "type": "message",
   "date": "2017-07-05T23:07:48",
   "date_unixtime": "1499270868",
   "from": "Aprender español - Learn Spanish",
   "from_id": "channel1055581587",
   "text": [
    "📖 ",
    {
     "type": "bold",
     "text": "The gender of Spanish nouns"
    },
    "\nIn Spanish, nouns and articles can be masculine or feminine. This is called gender. In most dictionaries, masculine nouns are often marked by the abbreviation ",
    {
     "type": "bold",
     "text": "m."
    },
    " and feminine nouns by the abbreviation ",
    {
     "type": "bold",
     "text": "f."
    },
    " However, most of the time you can tell whether a noun is masculine or feminine by its last letters, or by its meaning. Here are a few hints.\n🔹Usually, when the last letter of a noun is ",
    {
     "type": "bold",
     "text": "-o"
    },
    " it is masculine, and when the last letter is ",
    {
     "type": "bold",
     "text": "-a"
    },
    " it is feminine:\n🇪🇸 el libro 🇬🇧 the book\n🇪🇸 el auto 🇬🇧 the car\n🇪🇸 el niño 🇬🇧 the boy (child)\n🇪🇸 la casa 🇬🇧 the house\n🇪🇸 la bicicleta 🇬🇧 the bicycle\n🇪🇸 la niña 🇬🇧 the girl (child)\nThere are some exceptions, though, such as ",
    {
     "type": "italic",
     "text": "la mano"
    },
    " (the hand), ",
    {
     "type": "italic",
     "text": "el mapa"
    },
    " (the map), ",
    {
     "type": "italic",
     "text": "el día"
    },
    " (the day) and ",
    {
     "type": "italic",
     "text": "el poeta"
    },
    " (the poet)\n🔹When the last letters of a noun are ",
    {
     "type": "bold",
     "text": "-ón, -án, -or, -ar, -er, -ema, -al"
    },
    " it is usually masculine:\n🇪🇸 el avión 🇬🇧 the plane\n🇪🇸 el volcán 🇬🇧 the volcano\n🇪🇸 el actor 🇬🇧 the actor\n🇪🇸 el hogar 🇬🇧 the home\n🇪🇸 el escáner 🇬🇧 the scanner\n🇪🇸 el tema 🇬🇧 the theme\n🇪🇸 el canal 🇬🇧 the channel\nException: ",
    {
     "type": "italic",
     "text": "la moral"
    },
    " (the moral)\n🔹When the last letters of a noun are ",
    {
     "type": "bold",
     "text": "-ión, -ad, -ud, -eza, -iz"
    },
    " it is feminine:\n🇪🇸 la canción 🇬🇧 the song\n🇪🇸 la ciudad 🇬🇧 the city\n🇪🇸 la solicitud 🇬🇧 the request\n🇪🇸 la belleza 🇬🇧 the beauty\n🇪🇸 la actriz 🇬🇧 the actress"
   ],
   "text_entities": [
    {
     "type": "plain",
     "text": "📖 "
    },
    {
     "type": "bold",
     "text": "The gender of Spanish nouns"
    },
    {
